2020-01-22,https://weibo.cn/comment/hot/IqEre8JbN?rl=2,虽然我们要相信国家科技，要相信医疗人员，可是必须说的是，现在医疗人员奋战一线也是非常危险的，大家真的只能从自身做起，防患于未然，才是减少国家和医疗人员的负担。可能信息的传播真的有延迟，所以大家更应该把信息传播给身边的人，让大家引起重视,1645
2020-01-22,https://weibo.cn/comment/hot/IqEre8JbN?rl=2,发国难财的，你的良心不会痛么,1605
2020-01-22,https://weibo.cn/comment/hot/IqEre8JbN?rl=2,我想问下什么价格才是正常的价格?,470
2020-01-22,https://weibo.cn/comment/hot/IqEre8JbN?rl=2,适当涨点无可厚非，如借病毒灾害之际哄抬价格支持严惩！,424
2020-01-22,https://weibo.cn/comment/hot/IqFiJ2f4g?rl=2,发国难财的都biss,20860
2020-01-22,https://weibo.cn/comment/hot/IqFiJ2f4g?rl=2,没用 黑龙江这偏远小县城 昨晚买普通口罩9.8/袋  今天买就涨到19.8/袋，给12315举报人家说：现在都是市场经济了，我们也没法管，买的多了自然就会涨，供不应求了嘛 政府全有理，吃亏的还是我们消费者，管控？呵呵（请送我上去谢谢,3640
2020-01-22,https://weibo.cn/comment/hot/IqFiJ2f4g?rl=2,淘宝搜了半圈几乎没找到什么正经经营卖医用外科口罩的卖家，销售者要么刻意模糊产品性能涉嫌销售欺诈，要么涨价几倍甚至近十倍恶意哄抬物价。可能由于有关部门在查这个事，大部分销售者纷纷下架店铺相关商品。希望监管部门也多多关注一下网络销售平台！！！,3275
2020-01-22,https://weibo.cn/comment/hot/IqFiJ2f4g?rl=2,拜托电视上多多宣传吧 还有短信 老人们真的不知道,2212
2020-01-22,https://weibo.cn/comment/hot/IqFiJ2f4g?rl=2,别发国难财,1222
2020-01-22,https://weibo.cn/comment/hot/IqFiJ2f4g?rl=2,别罚太重，毕竟人家只是想赚点钱过年，就罚这些人戴着自已的口罩去隔离病房打扫一下卫生吧！,1238
2020-01-22,https://weibo.cn/comment/hot/IqFs82MCO?rl=2,应该推迟开学吧,13699
2020-01-22,https://weibo.cn/comment/hot/IqFs82MCO?rl=2,高三的还在补课啊！,9278
2020-01-22,https://weibo.cn/comment/hot/IqFs82MCO?rl=2,没想到今年的年货是口罩。 ,8337
2020-01-22,https://weibo.cn/comment/hot/IqFs82MCO?rl=2,武汉那么多大学 真的推迟开学吧 减少人员流动！！！！！！！,3955
2020-01-22,https://weibo.cn/comment/hot/IqFs82MCO?rl=2,推迟开学吧,2597
2020-01-22,https://weibo.cn/comment/hot/IqFs82MCO?rl=2,就算不活动，学校上课，食堂，浴室宿舍都是无法避免的人口密集,1946
2020-01-22,https://weibo.cn/comment/hot/IqFTnDiDn?rl=2,建议大学生推迟开学,112914
2020-01-22,https://weibo.cn/comment/hot/IqFTnDiDn?rl=2,建议全国都推迟,101833
2020-01-22,https://weibo.cn/comment/hot/IqFTnDiDn?rl=2,大学生大学生,49283
2020-01-22,https://weibo.cn/comment/hot/IqFTnDiDn?rl=2,新疆西藏青海中国最后一道防线，大西北给我挺住,27216
2020-01-22,https://weibo.cn/comment/hot/IqFTnDiDn?rl=2,大学生停课 还有武汉的学生回各大高校上学怎么办……,22420
2020-01-22,https://weibo.cn/comment/hot/IqFTnDiDn?rl=2,别的省能不能考虑一下,16635
2020-01-22,https://weibo.cn/comment/hot/IqFTnDiDn?rl=2,大学生从各个地方赶去  更应该重视啊,10501
2020-01-22,https://weibo.cn/comment/hot/IqFTnDiDn?rl=2,高三怎么办啊 我很多朋友艺术生传媒生全都不能参加校考了 可以对湖北考生延期吗 难道眼睁睁看着他们放弃？,7665
2020-01-22,https://weibo.cn/comment/hot/IqHKm9Vds?rl=2,早该如此了…春运都十几天了,6083
2020-01-22,https://weibo.cn/comment/hot/IqHKm9Vds?rl=2,那两个发烧还偷偷跑去上海的人，应该抓起来！可恨的是还发微博炫耀！,2522
2020-01-22,https://weibo.cn/comment/hot/IqHKm9Vds?rl=2,是吗 我认识一个朋友今天刚出武汉 还发了个朋友圈炫耀 “成功出逃” 并说没人查,1332
2020-01-22,https://weibo.cn/comment/hot/IqHKm9Vds?rl=2,关键是有潜伏期，当时查不出来，实际上已经扩散了。突然间爆发的确诊人数就是证据，武汉早就应该封城，现在封已经晚了，何况他还不封。感觉比电影《铁线虫》更可怕，电影里起码还有特效药，而我们现在没有。,666
2020-01-22,https://weibo.cn/comment/hot/IqHKm9Vds?rl=2,严格排查 为什么扬州一女子明知丈夫已确诊新型冠状病毒感染的肺炎还能坐高铁回扬州探亲访友？难道确诊人员的家属不需要隔离观察的吗？,584
2020-01-22,https://weibo.cn/comment/hot/IqHKm9Vds?rl=2,严格一点，不要乱跑！,353
2020-01-22,https://weibo.cn/comment/hot/IqHKm9Vds?rl=2,这就对啦兄弟！如果需要，一定要封城！全国14亿人口的安全呀……,337
2020-01-22,https://weibo.cn/comment/hot/IqzhUd9xt?rl=2,真的可以考虑航班封锁了，武汉是源头啊,4736
2020-01-21,https://weibo.cn/comment/hot/IqzhUd9xt?rl=2,全国各地都有，不要认为自己的城市没有报道出来就是安全，潜在的病号数不胜数，我们要做的是保护好自己。,2785
2020-01-22,https://weibo.cn/comment/hot/IqzhUd9xt?rl=2,这些武汉人好迷啊  全国各地跑  求您们了别瞎跑了成吗  河北一直没有我还庆幸呢  结果一个武汉医学生回保定疑似了  瞎跑什么呢？ ？,2711
2020-01-22,https://weibo.cn/comment/hot/IqzhUd9xt?rl=2,非典那年太小不懂，现在真的会害怕了,1152
2020-01-21,https://weibo.cn/comment/hot/IqzhUd9xt?rl=2,#建议各大学酌情延迟开学日期#,861
2020-01-21,https://weibo.cn/comment/hot/Iqw41d5LA?rl=2,希望走私野生动物和吃野生动物的柴废都早点从地球消失！真是全球人民替你们背锅！,865
2020-01-21,https://weibo.cn/comment/hot/Iqw41d5LA?rl=2,回家过年的会不会传染到东南西北啊，好怕,270
2020-01-21,https://weibo.cn/comment/hot/Iqw41d5LA?rl=2,别再怪武汉了好吗 谁都不希望发生这种事情 难道只有武汉有吃野味的人？？其次也别说是武汉政府瞒着不报 研究需要时间啊 19号试剂盒研究出来了才能快速的确诊啊 何况还有潜伏期 能不能不要张嘴就来？？？你是政府人员了还是干什么了？？？,17
2020-01-21,https://weibo.cn/comment/hot/Iqw41d5LA?rl=2,全都是武汉带出去的[捂脸][捂脸],169
2020-01-21,https://weibo.cn/comment/hot/Iqw41d5LA?rl=2,高度重视，武汉市委行动慢了，隔离措施现在才开始,97
2020-01-21,https://weibo.cn/comment/hot/IqwF8w0cF?rl=2,求求你们，发一些短信提醒吧！！！要不然很多人对疫情都不重视啊！！！呜呜,2394
2020-01-21,https://weibo.cn/comment/hot/IqwF8w0cF?rl=2,发一些短信提醒吧！！！要不然很多人对疫情都不重视啊！！！,1480
2020-01-21,https://weibo.cn/comment/hot/IqwF8w0cF?rl=2,发短信给全国人民吧！！！老人家真的完全不重视！！！！,1146
2020-01-21,https://weibo.cn/comment/hot/IqwF8w0cF?rl=2,三不笑：不笑天灾，不笑人祸，不笑疾病。 三不黑：育人之师，救人之医，护国之军。 ,374
2020-01-21,https://weibo.cn/comment/hot/IqwF8w0cF?rl=2,请确定湖南永州肺炎病例真假性  新闻滚动播放！！！大家多给中老年人宣传一下，现在好多中老年都不相信疫情的严重性！很多人都不知道情况，跟他们普及也听不进去，觉得小题大做，电视多做普及吧，起码引起重视！又逢春运，人流密集，再不重视，不提前预防，更是让人担忧！！！,240
2020-01-21,https://weibo.cn/comment/hot/IqwF8w0cF?rl=2,刚刚不小心看到一个大连说武汉跑出来的病人 没看完就被删了 谁有截图啊？？？,7
2020-01-21,https://weibo.cn/comment/hot/IqwF8w0cF?rl=2,中国移动联通电信赶紧发一下短信提醒吧！！,171
2020-01-21,https://weibo.cn/comment/hot/IqwF8w0cF?rl=2,新闻滚动播放！！！大家多给中老年人宣传一下，现在好多中老年都不相信疫情的严重性！很多人都不知道情况，跟他们普及也听不进去，觉得小题大做，电视多做普及吧，起码引起重视！又逢春运，人流密集，再不重视，不提前预防，更是让人担忧！！！,49
2020-01-21,https://weibo.cn/comment/hot/IqwNexqlO?rl=2,真的要委屈一下武汉市民了 非常时期，非常手段！,1150
2020-01-21,https://weibo.cn/comment/hot/IqwNexqlO?rl=2,为了对武汉人负责和对全国人民负责，请求对武汉先暂时封城，好主要着手对抗病毒肺炎,686
2020-01-21,https://weibo.cn/comment/hot/IqwNexqlO?rl=2,平安啊🙏🙏🙏网商也别在这上面赚钱了，武汉市民们要注意安全！！！,312
2020-01-21,https://weibo.cn/comment/hot/IqwNexqlO?rl=2,“京天成生物”宣布成功研制新型冠状病毒的抗体[强],10
2020-01-21,https://weibo.cn/comment/hot/IqwNexqlO?rl=2,过完年就快开学了 武汉高校众多 建议延期开学！,5
2020-01-21,https://weibo.cn/comment/hot/IqwNexqlO?rl=2,各位姐妹！！！！注意安全！！！！！！！！！！！！！！！！！！！！！！！！！！！！！！！！！！！！！！！！！！！！！！！！！！！！！！！！！！！！！！！！！！！！！！！,130
2020-01-21,https://weibo.cn/comment/hot/Iqx5p0ZcO?rl=2,希望今天的新闻多报道几次，各卫视也滚动播出宣传，短信也发，让中老年人高度重视！！我们跟他们说根本不听！觉得没那么严重,1197
2020-01-21,https://weibo.cn/comment/hot/Iqx5p0ZcO?rl=2,请关注下武汉周边城市好吗？湖北省内宜昌 、襄阳、荆门等等，全国各地海外都有了，然后我所在的城市却毫无消息，人们也不重视。宜昌武汉之间每天光动车就有很多趟，然后却没有媒体、政府关注我们这些小城市！,1097
2020-01-21,https://weibo.cn/comment/hot/Iqx5p0ZcO?rl=2,呼吁！现在能不到武汉去就不去，武汉人能不出来就不出来 非常时期 非常手段,323
2020-01-21,https://weibo.cn/comment/hot/Iqx5p0ZcO?rl=2,在12306上可以退差价么？我今天把票退了还扣除手续费了,28
2020-01-21,https://weibo.cn/comment/hot/Iqx5p0ZcO?rl=2,现在忽悠武汉人能不出来就不出来等多提下拜年的事吗？有些人觉得拜年和出门是两码事，过年一定要串门要团圆,5
2020-01-21,https://weibo.cn/comment/hot/Iqx5p0ZcO?rl=2,我今天才退票,2
2020-01-21,https://weibo.cn/comment/hot/IqxH7wPOe?rl=2,钟南山院士说，没有特殊情况不要去武汉！希望大学如果有可能的话，尽量晚一点开学啊！（把落下的上课时间挪到暑假补也可以啊！）？一定要做好日常防护，消毒措施！过年了，大家还有医护人员都要平平安安的！,1965
2020-01-21,https://weibo.cn/comment/hot/IqxH7wPOe?rl=2,疫情来了想到医生，火灾来了想到消防员，治安不好了想起警察，战争来了想起军人。平时多一点尊重多好！！！,1667
2020-01-21,https://weibo.cn/comment/hot/IqxH7wPOe?rl=2,麻烦！！！安排电信联通移动这些发一下提醒的短信！！！家长老人们的防范意识实在还是太淡薄了！还有很多人不了解带口罩的重要性！！！,181
2020-01-21,https://weibo.cn/comment/hot/IqxH7wPOe?rl=2,各种yxh又开始粘贴一模一样的文案了…,373
2020-01-21,https://weibo.cn/comment/hot/IqxH7wPOe?rl=2,愿天佑我中华🙏🙏,323
2020-01-21,https://weibo.cn/comment/hot/IqxH7wPOe?rl=2,我不敢相信这是主流媒体写的，？病例增多的原因是因为设置更多的发热门诊？意思门诊不多检测出的不多就等于群众没有感染呗？？？这是人日的水平？,21
2020-01-21,https://weibo.cn/comment/hot/IqxH7wPOe?rl=2,就是说，本来就有这么多，是因为技术原因发现的快,16
2020-01-21,https://weibo.cn/comment/hot/IqxUJ8EgQ?rl=2,钟南山院士说，没有特殊情况不要去武汉！过年了，大家还有医护人员都要平平安安的！大家多给中老年人宣传一下，现在好多中老年都不相信疫情的严重性！很多人都不知道情况，跟他们普及也听不进去，觉得小题大做，电视多做普及吧，起码引起重视，又逢春运，人流密集，再不重视，不提前预防，更是让人担忧,657
2020-01-21,https://weibo.cn/comment/hot/IqxUJ8EgQ?rl=2,体现出社会主义制度的优越性,339
2020-01-21,https://weibo.cn/comment/hot/IqxUJ8EgQ?rl=2,@中国移动 大佬，要不咱全国人民发一些相关新闻短信📨，提醒大家注意防范措施，我感觉移动覆盖人群范围应该会特别多的吧。,20
2020-01-21,https://weibo.cn/comment/hot/IqxUJ8EgQ?rl=2,请求新闻滚动播放，加强中老年防护意识。请严格把控口罩价格，打击不良商家特殊时期哄抬物价。希望大家都平安，前线的医生和工作人员都辛苦了。 致敬！武汉加油。,166
2020-01-21,https://weibo.cn/comment/hot/IqxUJ8EgQ?rl=2,1⃣新闻滚动播放，手机通讯三大运营商发短信提醒重视2⃣管控口罩价格，保证口罩供给3⃣注意经过武汉流动人员4⃣给春运工作者发放口罩,133
2020-01-21,https://weibo.cn/comment/hot/IqxUJ8EgQ?rl=2,真正是社会主义好！！,48
2020-01-21,https://weibo.cn/comment/hot/IqxUJ8EgQ?rl=2,真的好怕但是我相信国家,50
2020-01-21,https://weibo.cn/comment/hot/IqxUJ8EgQ?rl=2,请求新闻滚动播放，加强中老年防护意识。请严格把控口罩价格，打击不良商家特殊时期哄抬物价。希望大家都平安，前线的医生和工作人员都辛苦了。 致敬！武汉加油。,45
2020-01-21,https://weibo.cn/comment/hot/IqybMorZQ?rl=2,请求电视滚动播放，联通电信移动发短信，加强中老年防护意识，让大家都重视起来，有症状及时就医，不要抱侥幸心理!!!,1674
2020-01-21,https://weibo.cn/comment/hot/IqybMorZQ?rl=2,真把人急死了  跟我爸妈说新型冠状病毒啥啥啥啥的 买几个口罩备着 他们说他们身体硬着呢？？？？？你们身体硬我的不硬啊 真想摁着他们的头给我麻溜的戴口罩😤😤,832
2020-01-21,https://weibo.cn/comment/hot/IqybMorZQ?rl=2,钟南山院士说，没有特殊情况不要去武汉！过年了，大家还有医护人员都要平平安安的！大家多给中老年人宣传一下，现在好多中老年都不相信疫情的严重性！很多人都不知道情况，跟他们普及也听不进去，觉得小题大做，电视多做普及吧，起码引起重视，又逢春运，人流密集，再不重视，不提前预防，更是让人担忧,679
2020-01-21,https://weibo.cn/comment/hot/IqybMorZQ?rl=2,柳叶刀新年第一篇《Protect Chinese doctors》，就问一句，丢不丢人？,6
2020-01-21,https://weibo.cn/comment/hot/IqybMorZQ?rl=2,希望接下来都是好消息。武汉加油,222
2020-01-21,https://weibo.cn/comment/hot/IqyHisK4l?rl=2,武汉加油！我们一起加油！,113876
2020-01-21,https://weibo.cn/comment/hot/IqyHisK4l?rl=2,武汉加油！⛽️大家都辛苦了🙏🙏,88916
2020-01-21,https://weibo.cn/comment/hot/IqyHisK4l?rl=2,你能！我能！武汉能！,71767
2020-01-21,https://weibo.cn/comment/hot/IqyHisK4l?rl=2,武汉加油！！！肯定能平安度过,55998
2020-01-21,https://weibo.cn/comment/hot/IqyHisK4l?rl=2,加油武汉,40499
2020-01-21,https://weibo.cn/comment/hot/IqyHisK4l?rl=2,武汉加油[加油]🙏,34055
2020-01-21,https://weibo.cn/comment/hot/IqyHisK4l?rl=2,加油加油！冲冲冲！！！很快就会好起来的！,17540
2020-01-21,https://weibo.cn/comment/hot/IqyHisK4l?rl=2,武汉加油💪,14208
2020-01-21,https://weibo.cn/comment/hot/Iqz6ikCxz?rl=2,请不要发国难财,33559
2020-01-21,https://weibo.cn/comment/hot/Iqz6ikCxz?rl=2,我现在什么都不恨，就恨那些吃野生动物的逼人，恨我一个堂堂正正的当代人为什么要和这种野蛮人生活在一个世界。 ,24826
2020-01-21,https://weibo.cn/comment/hot/Iqz6ikCxz?rl=2,三大通讯运营商 发信息提示提示吧！好多人不玩微博的  特别是年纪大的人。我认为真的很有必要！我家人亲戚朋友都是我一个一个转告的 这样真的很麻烦 希望能发下 感谢你们 拜托了@中国移动@中国联通@中国电信🙏🏿,8072
2020-01-21,https://weibo.cn/comment/hot/Iqz6ikCxz?rl=2,看看淘宝上卖n95的 你说过年了把工人重新召回适当涨价完全可以理解但是别你🐎太离谱 发国难财给自己买棺材吗,6415
2020-01-22,https://weibo.cn/comment/hot/Iqz6ikCxz?rl=2,广东政府真的👌，每次各地有什么事最先行动的都是广东,3744
2020-01-21,https://weibo.cn/comment/hot/Iqz6ikCxz?rl=2,市监局加油！,992
2020-01-21,https://weibo.cn/comment/hot/Iqz6ikCxz?rl=2,发国难财的人没有心！！！,1044
2020-01-21,https://weibo.cn/comment/hot/IqvyXd1px?rl=2,新闻滚动播放！！！！谢谢！！！,107281
2020-01-21,https://weibo.cn/comment/hot/IqvyXd1px?rl=2,现在人口流动大，大家还是多注意点从武汉回来的人(没有歧视武汉的意思)武汉人民 出门戴口罩 保护好自己,61711
2020-01-21,https://weibo.cn/comment/hot/IqvyXd1px?rl=2,能不能请求管理一下口罩价格啊，都天价了，这样发疫情财也太过分了吧！！！！,20610
2020-01-21,https://weibo.cn/comment/hot/IqvyXd1px?rl=2,相信国家 相信医务工作人员,14757
2020-01-21,https://weibo.cn/comment/hot/IqvyXd1px?rl=2,支持，尽量让高铁啥的工作人员都带口罩,14837
2020-01-21,https://weibo.cn/comment/hot/IqvyXd1px?rl=2,请加大宣传力度！！我爸不信非说是卖口罩的炒作！谢谢！相信国家,12485
2020-01-21,https://weibo.cn/comment/hot/IqvyXd1px?rl=2,建议各个电信运营商全覆盖发短信通知,11625
2020-01-21,https://weibo.cn/comment/hot/IqvyXd1px?rl=2,那些说什么只有武汉人自己不知道自己被隔离了的憨批 这种抖机灵真的是让人作呕,10356
2020-01-19,https://weibo.cn/comment/hot/IqeHFBHGS?rl=2,希望大家都能平平安安,17020
2020-01-19,https://weibo.cn/comment/hot/IqeHFBHGS?rl=2,加油找源头，谢谢🙏,11768
2020-01-19,https://weibo.cn/comment/hot/IqeHFBHGS?rl=2,这就好了！最近每天每时每刻都在密切关注这一事态发展，终于放心了！,3027
2020-01-19,https://weibo.cn/comment/hot/IqeHFBHGS?rl=2,嗯嗯收到大家出门注意防护！！！,2595
2020-01-19,https://weibo.cn/comment/hot/IqeHFBHGS?rl=2,评论的抖机灵能不能适度一点啊？条新闻说的是武汉肺炎，这么严肃的事情拿来抖机灵？,3287
2020-01-19,https://weibo.cn/comment/hot/IqeHFBHGS?rl=2,那些老是刷g的人有意思吗？哪件事更重要自己不清楚？你们已经把这件事变成一个可以博点赞的梗而不是所谓的让大众不要遗忘这个新闻？！天天在不相关尤其是这种很重要的事情下面刷真的很烦啊,2008
2020-01-19,https://weibo.cn/comment/hot/IqeHFBHGS?rl=2,不信，不传，继续开大G,884
2020-01-19,https://weibo.cn/comment/hot/IqbaTDCNU?rl=2,故宫也请看管严查,1066
2020-01-19,https://weibo.cn/comment/hot/IqbaTDCNU?rl=2,热搜速删，官媒降温。已有人对网友在无关新闻下刷“故宫大G女”做法表示“愤怒与鄙视”…然而如此公然炫耀特权，挑战公序良知，践踏公共规则的不齿行为，没有责任人，没有具体惩戒，轻轻巧巧几句道歉就想掩尽天下人耳目糊弄过去，如果再连民众通过网络刷一下的发声权利都禁止，类似恶例只会层出不穷！,675
2020-01-19,https://weibo.cn/comment/hot/IqbaTDCNU?rl=2,我看成何刚了，对不起,725
2020-01-19,https://weibo.cn/comment/hot/IqbaTDCNU?rl=2,以前去故宫，看到地砖的残破，仿佛看到中华民族数千年来，筚路蓝缕，苦难行军深深感受到了历史的厚重，现在才知道，原来是被周一的奔驰大G碾压的[社会社会][社会社会],92
2020-01-19,https://weibo.cn/comment/hot/IqbaTDCNU?rl=2,中福在线求彻查！我的微博第一个视频,304
2020-01-20,https://weibo.cn/comment/hot/IqhJNhtXg?rl=2,好吓人 一晚上刷到仨,657
2020-01-20,https://weibo.cn/comment/hot/IqhJNhtXg?rl=2,1.出门戴口罩，勤洗手  2.咳嗽或打喷嚏时捂住口鼻  3.将肉蛋彻底做熟  4. 避免与呼吸道感染患者密切接触  5.避免近距离接触野生动物或活牲畜  6.不要随地吐痰！ 7. 不要去人多的地方凑热闹！,579
2020-01-20,https://weibo.cn/comment/hot/IqhJNhtXg?rl=2,确诊不可怕，能控制疫情不大规模扩散就好,253
2020-01-20,https://weibo.cn/comment/hot/IqhJNhtXg?rl=2,"不怕,病毒来了，广东人把它给吃了， ，",20
2020-01-20,https://weibo.cn/comment/hot/IqhJNhtXg?rl=2,麻烦报道一下b站曝光中福在线事件,215
2020-01-20,https://weibo.cn/comment/hot/IqhJNhtXg?rl=2,控制住！提醒家人朋友出门戴口罩啊！！！！！！！！！！！！,52
2020-01-20,https://weibo.cn/comment/hot/IqhJNhtXg?rl=2,小编快睡觉了🙏🙏,36
2020-01-20,https://weibo.cn/comment/hot/IqhJNhtXg?rl=2,希望尽快能控制好啊,28
2020-01-20,https://weibo.cn/comment/hot/IqmyrEsiq?rl=2,朝阳医院的医生,33820
2020-01-20,https://weibo.cn/comment/hot/IqmyrEsiq?rl=2,朝阳医院！！,17943
2020-01-20,https://weibo.cn/comment/hot/IqmyrEsiq?rl=2,说真的那些吃野生动物的怎么一点记性没有？当初非典也是这帮人，现在武汉肺炎又是这帮人，真是自讨苦吃也就算了，还要祸害整个人类族群，吃的时候满足自己口腹，却要整个人类帮着还债。,7790
2020-01-20,https://weibo.cn/comment/hot/IqmyrEsiq?rl=2,快G年了。大家注意安全,2615
2020-01-20,https://weibo.cn/comment/hot/IqoiCa5iv?rl=2,请大家善待医护人员，他们真的不容易，请不要拿医生来泄愤!!!每次治疗都是一场战斗，医生都是义无反顾的在第一线，用生命和病毒抗争，医生应该受到大家尊解和理解!,2440
2020-01-20,https://weibo.cn/comment/hot/IqoiCa5iv?rl=2,请不要再伤害医护人员了请不要再伤害医护人员了请不要再伤害医护人员了,1439
2020-01-20,https://weibo.cn/comment/hot/IqoiCa5iv?rl=2,辽宁挺住，这个咱们不上榜,318
2020-01-20,https://weibo.cn/comment/hot/IqoiCa5iv?rl=2,sars已经是快17年前的事情了，相信一点中国医学技术吧，做好防护就可以了，别在网上搞得那么恐慌，也别逼武汉人恐慌,176
2020-01-20,https://weibo.cn/comment/hot/IqoiCa5iv?rl=2,春运期间？？好可怕,114
2020-01-20,https://weibo.cn/comment/hot/IqoycpfWU?rl=2,预防千万条，口罩第一条。不往人群挤，病毒不缠你。洗手很重要，胜过吃补药。通风也要紧，疾病无踪影。,761
2020-01-20,https://weibo.cn/comment/hot/IqoycpfWU?rl=2,正值春运期间，万一病毒有爆发迹象，建议能够延长春节假期，推迟春节返程客流。,709
2020-01-20,https://weibo.cn/comment/hot/IqoycpfWU?rl=2,唉 一边是肺炎 一边是病人的砍刀,521
2020-01-20,https://weibo.cn/comment/hot/IqoycpfWU?rl=2,年轻人已经非常有意识知道防范了，可是爸爸妈妈年纪的还很缺乏，希望新闻联播多播播,12
2020-01-20,https://weibo.cn/comment/hot/IqoycpfWU?rl=2,大家一定要注意勤洗手，不要去人多的地方🙏🙏🙏,115
2020-01-20,https://weibo.cn/comment/hot/IqoycpfWU?rl=2,上午说了句封锁武汉，招来一堆骂。说不现实，有困难。非典时期可是封锁全国各地。现在好了，扩散了吧,101
2020-01-20,https://weibo.cn/comment/hot/IqoycpfWU?rl=2,真的不排除人传人啊，大家记得戴口罩啊，注意防范,70
2020-01-20,https://weibo.cn/comment/hot/IqpJvqseJ?rl=2,天呐  要注意安全啊 白衣天使,8659
2020-01-20,https://weibo.cn/comment/hot/IqpJvqseJ?rl=2,请不要再伤害医护人员请不要再伤害医护人员请不要再伤害医护人员,5954
2020-01-20,https://weibo.cn/comment/hot/IqpJvqseJ?rl=2,钟南山访问要点： 1、确认可以人传人，基于武汉和广东案例。 2、有医务人员被传染。 3、源头目前不清楚，但可能是竹鼠、獾这种野生动物（尽量别去碰野味）。 4、有发热及时就医。 5、买不到N95，普通口罩也可以起到阻止飞沫传播的作用（该戴口罩戴口罩,4385
2020-01-20,https://weibo.cn/comment/hot/IqpJvqseJ?rl=2,前有肆虐的病毒 后有病人的砍刀 为所有奋斗在前线的医护人员祈祷,3047
2020-01-20,https://weibo.cn/comment/hot/IqpJvqseJ?rl=2,别扩大范围了，在武汉别出了，没在武汉别进了,1502
2020-01-20,https://weibo.cn/comment/hot/IqpJvqseJ?rl=2,希望试剂可以发到全国各个城市，不论发达还是落后。越是落后的省份危机越大，大家防范意识弱，或消息闭塞，医疗不发达无法确诊较多。希望国家给每一个省份发相关试剂，拜托!很多农民工都是从发达城市包括武汉返乡过年，希望重视!,1127
2020-01-20,https://weibo.cn/comment/hot/IqpJvqseJ?rl=2,我是武汉人 我今天出门的时候大多数人都带了口罩 我的家人同学也都是尽量不出门的 我们也不想发生这种事 所以那些地域黑 的给我闭嘴🙃,843
2020-01-20,https://weibo.cn/comment/hot/IqpJvqseJ?rl=2,只有钟南山院士出来说话 大家才相信 才踏实！希望我们医护人员平安！,620
2020-01-21,https://weibo.cn/comment/hot/IqsLy4dW6?rl=2,电视上也要滚动播报啊，父母根本不重视，很多人都不知道情况，跟他们普及也听不进去，觉得小题大做，电视多做普及吧，起码引起重视,59872
