2020-01-21,https://weibo.cn/comment/hot/IqsLy4dW6?rl=2,预防千万条，口罩第一条。健康第一位，不要吃野味。不往人群挤，病毒不缠你。洗手很重要，胜过吃补药。通风也要紧，疾病无踪影。,30221
2020-01-21,https://weibo.cn/comment/hot/IqsLy4dW6?rl=2,看到武汉一年轻护士被调征去隔离医院工作后心情的微博，我非常理解，每当遇到人人自危的传染病，医护人员总是要冲在第一线，他们也会怕。  我们要敬畏他们的职业，希望永远不要再出现伤害医生的事件了，否则没人愿意当医生，没人考医学院，水平高的医生也会到国外工作，那时候我们只有绝望。,22259
2020-01-21,https://weibo.cn/comment/hot/IqsLy4dW6?rl=2,感谢钟南山院士，80多岁的老人，在病情发展的危急时刻，再一次挂帅出征，相信我们的国家，相信医疗团队，早日找出传染源，彻底根治，希望所有的朋友们都开开心心，平平安安过大年。。。。。,7604
2020-01-21,https://weibo.cn/comment/hot/IqsLy4dW6?rl=2,戴口罩出门🙏🙏🙏,6891
2020-01-21,https://weibo.cn/comment/hot/IqsLy4dW6?rl=2,现在国家比我们还着急，新病毒感染途径和特征需要时间去研究，我们需要做的是：  1、没有特殊情况，老老实实家里呆着 2、命比过年重要，实在不行就异地过个年 3、不要侥幸，认真按照专家的话做好防御 4、相信我们国家的实力，17年前我们能打败非典，现在更能。,6675
2020-01-21,https://weibo.cn/comment/hot/IqsLy4dW6?rl=2,千万别有事没事往人多的地方跑，出门务必带口罩，勤洗手，按时作息，生活规律，注意饮食（不要暴饮暴食），加强锻炼，别感冒！别感冒！别感冒！感冒自身免疫力会下降～～～,3669
2020-01-21,https://weibo.cn/comment/hot/IqsLy4dW6?rl=2,这个就有点严重了，甲类只有两个，鼠疫、霍乱。乙类安装甲类管理的有，炭疽，非典，禽流感，（脊髓灰质炎）,2868
2020-01-21,https://weibo.cn/comment/hot/IqsLy4dW6?rl=2,控制输出输入很重要。一定要在全国特别是武汉加强宣传，落实火车站和机场的筛查检测。病毒有潜伏期，春运期间疫情扩大是肯定的，但强有力的控制可以降低疫情上升高度。春运前没有采取严格的口岸检查，现在开始也不晚。严阵以待才会避免疫情爆发，降低疫情扩散速度。,2395
2020-01-21,https://weibo.cn/comment/hot/IqsLy4dW6?rl=2,各大火车站那点人根本控不住几亿人，测温仪器也不够。百姓现在都沉浸在春节的喜庆中，没人去在意这个了，特别是老人家。前面对病毒的弱化宣传已经先入为主的让大部分人不以为然，个个事不关己高高挂起,2210
2020-01-21,https://weibo.cn/comment/hot/Iqtn545sR?rl=2,钟南山：没有特殊情况就不要去武汉了，换个意思：没有特殊情况就不要离开武汉了。,4083
2020-01-21,https://weibo.cn/comment/hot/Iqtn545sR?rl=2,保护好医护人员 他可能是逆行的天使,2479
2020-01-21,https://weibo.cn/comment/hot/Iqtn545sR?rl=2,①出门最好戴口罩勤洗手 ‼️ ②咳嗽或打喷嚏时捂住口鼻避免唾液飞溅‼️ ③将肉类蛋类禽类彻底煮熟‼️ ④避免与呼吸道感染者接触 ‼️ ⑤避免近距离接触野生动物和活牲畜‼️‼️ ⑥不要随地吐痰 ‼️ ⑦尽量避免去人多的地方‼️ ⑧有发热咳嗽现象一定要及时就医不要拖‼️ ⑨不要食用野味‼️,967
2020-01-21,https://weibo.cn/comment/hot/Iqtn545sR?rl=2,现在国家比我们还着急，新病毒感染途径和特征需要时间去研究，我们需要做的是：  1、没有特殊情况，老老实实家里呆着 2、命比过年重要，实在不行就异地过个年 3、不要侥幸，认真按照专家的话做好防御 4、相信我们国家的实力，17年前我们能打败非典，现在更能。,845
2020-01-21,https://weibo.cn/comment/hot/Iqtn545sR?rl=2,处理疫情的方式，这么多年了，没丝毫改变！一点不长记性——上个星期还“已经有效控制”，形势一片大好，街头巷尾一团祥和气氛，诸如火车站等人流密集的地方连一点基本的防控措施都没有…像极了当年非典疫情爆发初期我在广东顺德所亲眼见证到的情形。,737
2020-01-21,https://weibo.cn/comment/hot/Iqtn545sR?rl=2,一定要重视啊 武汉的朋友们！,330
2020-01-15,https://weibo.cn/comment/hot/IpyuNsHyO?rl=2,出门注意安全，戴好口罩,138
2020-01-15,https://weibo.cn/comment/hot/IpyuNsHyO?rl=2,无论怎么说，这次相比非典，更加开放透明高效。,86
2020-01-15,https://weibo.cn/comment/hot/IpyuNsHyO?rl=2,未发现人传人一一>未明确发现人传人一一>不排除人传人可能一一>持续人传人可能性低。,63
2020-01-15,https://weibo.cn/comment/hot/IpyuNsHyO?rl=2,注意预防。,40
2020-01-15,https://weibo.cn/comment/hot/IpyuNsHyO?rl=2,好好做好预防措施,21
2020-01-15,https://weibo.cn/comment/hot/IpyuNsHyO?rl=2,武汉得好好查查来源，那菜场究竟有什么导致这些人发病。不要治好病就完事了，要追根究底才能结后患,26
2020-01-15,https://weibo.cn/comment/hot/IpyuNsHyO?rl=2,大多数病例与华南海鲜批发市场暴露相关，少数病例否认有华南海鲜批发市场暴露史，个别病例曾接触过类似病例。跟吃海鲜有关系吗？,20
2019-12-31,https://weibo.cn/comment/hot/Injjdmmx1?rl=2,开玩笑，这都2020年了，武汉诶，中部大城市，文中的几个机构单位都是佼佼者，大家真不必惊慌，而且官方反应已经很迅速了，给我大武汉点赞,3157
2019-12-31,https://weibo.cn/comment/hot/Injjdmmx1?rl=2,突然想起了当年的非典，我工作在一线，天气热，穿着特制隔离衣，每天都全身湿透，我们那边疫情不严重，所以也没感觉多吓人，直到后面全部都稳定后，跟同行交流时才发现自己曾经离死那么近,1885
2019-12-31,https://weibo.cn/comment/hot/Injjdmmx1?rl=2,说实话就算是非典，恐慌有什么用，该做好防预就做好防预，少去人流密集的地方,1589
2019-12-31,https://weibo.cn/comment/hot/Injjdmmx1?rl=2,希望一切都好，一切以官方为准！！,508
2019-12-31,https://weibo.cn/comment/hot/Injjdmmx1?rl=2,不信谣不造谣不传谣！！！愿一切平安！！！,347
2019-12-31,https://weibo.cn/comment/hot/Injjdmmx1?rl=2,祝武汉的父老乡亲平平安安,365
2019-12-31,https://weibo.cn/comment/hot/Injjdmmx1?rl=2,没有人传染的 一下子有27个，这个结果太不令人信服了,9
2020-01-03,https://weibo.cn/comment/hot/InMVu0WYx?rl=2,天哪！医护人员也要注意安全！大家都平平安安！,8525
2020-01-03,https://weibo.cn/comment/hot/InMVu0WYx?rl=2,感觉宣布消息挺及时的,5513
2020-01-03,https://weibo.cn/comment/hot/InMVu0WYx?rl=2,好严重啊，愿平安🙏,2304
2020-01-03,https://weibo.cn/comment/hot/InMVu0WYx?rl=2,还没查出病因，看来是新的病毒了,1924
2020-01-03,https://weibo.cn/comment/hot/InMVu0WYx?rl=2,没查明原因之前，建议封锁武汉，进出要进行检查身体,1016
2020-01-03,https://weibo.cn/comment/hot/InMVu0WYx?rl=2,之前说21，现在说44，严重了,645
2020-01-03,https://weibo.cn/comment/hot/InMVu0WYx?rl=2,赶快把抓别人造谣的八个人放了，古代还可以风闻言事呢！现在到底是什么年代？,558
2020-01-03,https://weibo.cn/comment/hot/InMVu0WYx?rl=2,感觉这次通报还是有点儿被舆论压迫的通报，确实是感染人数增加了，而传染途径，感染源也没找到，具体的治疗方法不明确，没有治愈病历反倒是重症人数增加了，最关键的是没有告知群众要如何有效的防护，希望每天通报而不是四天才知道官方的消息。,566
2020-01-11,https://weibo.cn/comment/hot/IoWcBwB0d?rl=2,新型病毒🦠！有点可怕😱,55
2020-01-21,https://weibo.cn/comment/hot/IoWcBwB0d?rl=2,王主任自己已经中招。。。一语成畿,61
2020-01-11,https://weibo.cn/comment/hot/IoWcBwB0d?rl=2,现在我们这里随处可见的口罩，希望病毒能早点清除,30
2020-01-11,https://weibo.cn/comment/hot/IoWcBwB0d?rl=2,祖国越是发展壮大，配套监管越要加强，科技与“魑魅魍魉”从未分开过，忘我之心有些国家从来就没有灭过🙏,22
2020-01-21,https://weibo.cn/comment/hot/IoWcBwB0d?rl=2,10天后，再看当初？,24
2020-01-11,https://weibo.cn/comment/hot/IoXuCg8QS?rl=2,愿平安健康🙏,133
2020-01-11,https://weibo.cn/comment/hot/IoXuCg8QS?rl=2,阅，事件描述清晰，思路明确。,58
2020-01-11,https://weibo.cn/comment/hot/IoXuCg8QS?rl=2,没想到会有人死亡，希望大家都平安🙏🙏🙏,44
2020-01-11,https://weibo.cn/comment/hot/IoXuCg8QS?rl=2,不信谣不传谣  早发现早治疗  大家平平安安,31
2020-01-11,https://weibo.cn/comment/hot/IoXuCg8QS?rl=2,其实只要及时通报，就不会引起恐慌的。,28
