,date,URL,content,numF,emotion
743,2020-01-23,https://weibo.cn/comment/hot/IqOMBqjE8?rl=2,能不能管管所有的旅游团，就这样了，还照常出现，不出行一分钱不退，国家旅游局能不能出来发声呀,20,neutral
744,2020-01-23,https://weibo.cn/comment/hot/IqP4N0VNt?rl=2,能不能官方呼吁下今年拜年从简，不要串门，不要聚餐，不要走亲戚了🙏🙏🙏我们自己说都不管用，大人们还是一样聚在一起。,1973,neutral
745,2020-01-23,https://weibo.cn/comment/hot/IqP4N0VNt?rl=2,可不可以大学延后开学🙏,843,suspicious
746,2020-01-23,https://weibo.cn/comment/hot/IqP4N0VNt?rl=2,疫情当头，恶意伤医 #荆门伤医#再给热度！！！,658,angry
747,2020-01-23,https://weibo.cn/comment/hot/IqP4N0VNt?rl=2,如果路上看到鄂A的牌子可以直接报警吗,397,neutral
748,2020-01-23,https://weibo.cn/comment/hot/IqP4N0VNt?rl=2,挺好的，但也不要调侃肺炎，看见有说  爱情都轮不到你，肺炎哪能轮的到你 憨批,328,satisfied
749,2020-01-23,https://weibo.cn/comment/hot/IqP4N0VNt?rl=2,荆门伤医事件关注一下吧,319,worry
750,2020-01-23,https://weibo.cn/comment/hot/IqP4N0VNt?rl=2,昨天已经有好多开私家车逃出来了   有的还发烧…,222,unsatisfied
751,2020-01-23,https://weibo.cn/comment/hot/IqP4N0VNt?rl=2,潜伏期差不多快到了，各地还会继续爬坡一段时间，委屈武汉人民了，一定要挺住！天佑我中华，2020请善待我的国人🙏,186,hopeful
752,2020-01-23,https://weibo.cn/comment/hot/IqPjriPxp?rl=2,#荆门伤医#  求求大家关注一下荆门伤医事件！妻子在一线感染科抗击病毒救人、同为医生的丈夫被患者20多个家属暴力殴打，被逼下跪！警方通报伤人者仅仅处罚500，拘留5天！现在施暴家属正在搜索医生信息，企图二次施暴！寒了白衣天使的心，寒了人民群众的心！,4479,unsatisfied
753,2020-01-23,https://weibo.cn/comment/hot/IqPjriPxp?rl=2,不得不说 浙江应急预案启动很及时,2391,unsatisfied
754,2020-01-23,https://weibo.cn/comment/hot/IqPjriPxp?rl=2,疫情当头，恶意伤医 #荆门伤医#再给热度！！！妻子感染科一线奋战肺炎，丈夫值班抢救伤者失败被家属殴打，闹事者罚款500拘留5天。真的太让人失望。太让医者心寒了吧！！！！,1821,angry
755,2020-01-23,https://weibo.cn/comment/hot/IqPjriPxp?rl=2,浙江这个做法也很棒啊,1062,excited
756,2020-01-23,https://weibo.cn/comment/hot/IqPjriPxp?rl=2,央视晚上七点的新闻联播  麻烦多费点时间播报，家里很多中老年看这个比较多，也信这个。要多报道。昨天才三分钟，重视程度远远不够。#如何说服爸妈退订年夜饭#,411,unsatisfied
757,2020-01-23,https://weibo.cn/comment/hot/IqQ5bAp6k?rl=2,造谣biss,5657,angry
758,2020-01-23,https://weibo.cn/comment/hot/IqQ5bAp6k?rl=2,传这种谣言的是坏,1004,neutral
759,2020-01-23,https://weibo.cn/comment/hot/IqQ5bAp6k?rl=2,武汉加油，天佑中华🙏,768,hopeful
760,2020-01-23,https://weibo.cn/comment/hot/IqQ5bAp6k?rl=2,#荆门伤医#  妻子前线抗疫，丈夫被打被逼下跪，拘役五天，罚款500，真是笑死人了🙏🙏🙏,403,shock
761,2020-01-24,https://weibo.cn/comment/hot/IqQ5bAp6k?rl=2,这也会信？,1,neutral
762,2020-01-23,https://weibo.cn/comment/hot/IqMSi6ruL?rl=2,一位武汉朋友的朋友圈：  这绝非是一个容易的决定  这是一个极其艰难宛如壮士断腕的决定  这不是一个“早该如此”的冷眼旁观  但也不是一个“草木皆兵”的恐怖宣召  这是一场需要团结、自觉、勇气和毅力的战争  愿每个人都能平安健康  愿所有医护工作者都能平安健康  向你们致以最崇高的敬意,28163,hopeful
763,2020-01-23,https://weibo.cn/comment/hot/IqMSi6ruL?rl=2,如果您来自疫区，您曾到过武汉，或接触过从武汉回来者，尽量不去接触别人，持续观察自己的健康状况14天！请自觉居家观察14天！这是一种觉悟，更是一种责任，也关乎您和您家人的健康！谢谢您！,8085,shock
764,2020-01-23,https://weibo.cn/comment/hot/IqMSi6ruL?rl=2,让站岗的兵哥哥们也把口罩戴上吧,7839,angry
765,2020-01-23,https://weibo.cn/comment/hot/IqMSi6ruL?rl=2,病毒消灭后，失职官员一个也跑不了,6982,excited
766,2020-01-23,https://weibo.cn/comment/hot/IqMSi6ruL?rl=2,今年过年不串门， 不串门呀不串门。 串门只串自家门， 客厅门，卧室门，厨房门，厕所门。 鼠年拜年不用跑， 至爱亲朋网上聊， 武汉疫情重灾区， 预防感染最重要！ 公园商场不用逛， 电视机前看报导。 一天到晚三件事， 吃饭睡觉网上聊。 今年过个特色年， 预祝大家新年好！,3361,angry
767,2020-01-23,https://weibo.cn/comment/hot/IqMSi6ruL?rl=2,2003年非典，全世界守护90后，2020年，换90后守护这个世界。 ,2396,neutral
768,2020-01-23,https://weibo.cn/comment/hot/IqMSi6ruL?rl=2,醒醒吧，这次的问题根源在“野味”，不是在“武汉”，只要野味不禁，这次在武汉，下次在哪谁知道？谁敢站出来保证你那个城市就没人吃野味？这个时候就别阴阳怪气到处拱火挑拨地域冲突了，控制疫情才是正事，大部分武汉市民才是最严重的受害者，武汉的医生才是最伟大的英雄，拱火的苍蝇们有什么贡献？,2086,angry
769,2020-01-23,https://weibo.cn/comment/hot/IqIpWgAqv?rl=2,医务工作者辛苦了 感谢🙏,85,moved
770,2020-01-23,https://weibo.cn/comment/hot/IqIpWgAqv?rl=2,也请你们注意安全，谢谢你们❤️,51,worry
771,2020-01-23,https://weibo.cn/comment/hot/IqIpWgAqv?rl=2,记者们也要保护好自己,32,neutral
772,2020-01-23,https://weibo.cn/comment/hot/IqIpWgAqv?rl=2,向所有医护人员致敬,20,moved
773,2020-01-23,https://weibo.cn/comment/hot/IqIpWgAqv?rl=2,致敬,8,moved
774,2020-01-23,https://weibo.cn/comment/hot/IqIpWgAqv?rl=2,平平安安🙏,5,hopeful
775,2020-01-23,https://weibo.cn/comment/hot/IqIpWgAqv?rl=2,#致敬疫情前线医护人员# 你们辛苦了！致敬！,3,moved
776,2020-01-23,https://weibo.cn/comment/hot/IqIJhEkVp?rl=2,求求了能不能号召一下今年不要走亲戚了啊 大家每年都见面真的不差这一年 老一辈信息闭塞几乎没有防范措施 可不可以一级一级下发点文件什么的通知一下啊下发到具体乡镇那种,2820,worry
777,2020-01-23,https://weibo.cn/comment/hot/IqIJhEkVp?rl=2,目前最想看到的一则新闻：新型冠状病毒成功得到控制 再无人员感染 所有医护人员平安,1137,hopeful
778,2020-01-23,https://weibo.cn/comment/hot/IqIJhEkVp?rl=2,很多老一辈的是觉得这辈子大风大雨都过来了，不太重视，其实这个时候免疫力较差的是年长者，也不懂怎么说，总之要多做防护吧！还是那句话，勤洗手，戴口罩，禁吃生食！口罩没get到去找非医用的，关键时刻关键对待！心态要稳住,704,unsatisfied
779,2020-01-23,https://weibo.cn/comment/hot/IqIJhEkVp?rl=2,滚，这个时候宣传“一封封朴实的请战书”去给医护人员施加道德压力，不如卫健委站出来说具体会给他们什么样的保障！！抗疫情不能靠他们肉搏，要有人力支持设备支持要防护到位！,517,satisfied
780,2020-01-23,https://weibo.cn/comment/hot/IqIJhEkVp?rl=2,求求封城，再不果断民心更乱，求求封城,356,worry
781,2020-01-23,https://weibo.cn/comment/hot/IqIJhEkVp?rl=2,说真的我真的害怕,138,worry
782,2020-01-23,https://weibo.cn/comment/hot/IqJB949T7?rl=2,武汉的机场和火车站是否可以停止中转？？？,3839,unsatisfied
783,2020-01-23,https://weibo.cn/comment/hot/IqJB949T7?rl=2,每一个人出门都要戴口罩，任何人都不要有侥幸心理，哪怕你所在的城市是18线，哪怕你所在的城市还没有病例，哪怕你觉得自己不会这么倒霉被传染。现在是春运期间人口流动非常大，但是你永远不会知道走在你身边的路人从哪里来，接触什么人。,3099,neutral
784,2020-01-23,https://weibo.cn/comment/hot/IqJB949T7?rl=2,建议武汉立刻封城,1918,neutral
785,2020-01-23,https://weibo.cn/comment/hot/IqJB949T7?rl=2,如果早一点开始，会有这么多省沦陷吗？,1898,neutral
786,2020-01-23,https://weibo.cn/comment/hot/IqM0vr2gv?rl=2,目前最想看到的一则新闻：新型冠状病毒成功得到控制 再无人员感染 所有医护人员平安,2914,hopeful
787,2020-01-23,https://weibo.cn/comment/hot/IqM0vr2gv?rl=2,坐标武汉旁边城市孝感，春运期间大批武汉人涌入。到目前一例都没有上报！！！官方所谓避免恐慌倒好，大街戴口罩的没几个，人来人往逛年货，活禽市场照样开，年味十足。叫大人戴口罩还嫌你烦，还都说小地方不会有事情。不想传播恐慌叫大家不过年，是想有关部门出面加强措施，提升市民的危机防范意识！,1756,unsatisfied
788,2020-01-23,https://weibo.cn/comment/hot/IqM0vr2gv?rl=2,我这个想法不知道能不能实现，每个地区都进行排查，看看有没有有近期从武汉回来的人，市到县，到片区，到小区，小区到栋，栋到户，都到位，如果有的就公布出来，因为过年，超市商场很多人，根本不知道哪个擦肩而过的人有没有潜在危险，而且太奇怪了，周边药店口罩都脱销了，为什么商场超市没几个人戴呢,1058,worry
789,2020-01-23,https://weibo.cn/comment/hot/IqM0vr2gv?rl=2,西藏 新疆 内蒙 青海 陕西 甘肃给我挺住了，武汉加油啊！！！,502,hopeful
790,2020-01-23,https://weibo.cn/comment/hot/IqM0vr2gv?rl=2,看到一新段子：本来以为猪肉是今年最抢手的年货了🔥 ，没想到最后关头，口罩杀出重围！,469,neutral
791,2020-01-23,https://weibo.cn/comment/hot/IqM0vr2gv?rl=2,请武汉市市长自动辞职吧，现在弄得“遍地开花”！,283,angry
792,2020-01-23,https://weibo.cn/comment/hot/IqMDEmtqV?rl=2,提醒用84消毒时 和洁厕灵千万别混用‼️会中毒‼️,780,neutral
793,2020-01-23,https://weibo.cn/comment/hot/IqMDEmtqV?rl=2,大家多给中老年人宣传一下，特别是小地方 现在好多中老年都不相信疫情的严重性！很多人都不知道情况，跟他们普及也听不进去，觉得小题大做，电视多做普及吧，特别是三大运营商短信通知起码引起重视，又逢春运，人流密集，再不重视，不提前预防，更是让人担忧 再次呼吁 别再吃野味了！！！,633,unsatisfied
794,2020-01-23,https://weibo.cn/comment/hot/IqMDEmtqV?rl=2,想对现在驾车逃离武汉的人们说一句：真没必要。目前全国的焦点在武汉，如果真的感染，你在武汉能获得的各种治疗条件肯定是最好的。都像你们这么逃，世界无处安全，人口流动增加后期控制难度，传染范围扩大的隐患会增加病毒变异和超级传播者出现的几率。无论是自己还是别人都得不到任何好处。,548,worry
795,2020-01-23,https://weibo.cn/comment/hot/IqMDEmtqV?rl=2,希望保证武汉基本物资充足。急需口罩！急需口罩！急需口罩！重要的事情说三遍！国家每个人都告诉我们武汉人要戴口罩，但没有一个人告诉我们哪里立马就能买到口罩！多数药店都断货，网上的口罩现在也运不到武汉！求求大家看到这条消息顶一下！不要让病毒在武汉来个瓮中捉鳖！,137,worry
796,2020-01-23,https://weibo.cn/comment/hot/IqMDEmtqV?rl=2,请重视农村务工返乡人员请重视农村务工返乡人员请重视农村务工返乡人员请重视农村务工返乡人员请重视农村务工返乡人员请重视农村务工返乡人员,335,moved
797,2020-01-23,https://weibo.cn/comment/hot/IqMDEmtqV?rl=2,武汉有些医院拒收重症病人！请重视！,13,hopeful
798,2020-01-23,https://weibo.cn/comment/hot/IqMDEmtqV?rl=2,对于趁火打劫，哄抬物价，发国难财的商家，经销商，零售商，就应该让他们倾家荡产，达到他们怀疑人生，小幅上涨还能接受，几倍，几十倍的涨价就太过分了，直接把这群人送疫区去吧,226,angry
799,2020-01-23,https://weibo.cn/comment/hot/IqMDEmtqV?rl=2,现在从武汉出去的人，都是昨天和前天在网上说不慌的人 我真的就服了 昨天前天微博下面的评论都是全国人都慌 就武汉人不慌,2,worry
800,2020-01-26,https://weibo.cn/comment/hot/IoWrwpsE1?rl=2,这时候的新闻还是一片大好，20天之后，湖北省长:“非常痛心、内疚和自责”。早干嘛去了？没有人比你们更了解当地的情况，真的有贴近群众吗？,24,unsatisfied
801,2020-01-26,https://weibo.cn/comment/hot/Irk9EFMeB?rl=2,能不能把第一例感染者照片发出来让全国人民瞻仰瞻仰，b嘴咋就那么馋。,8721,suspicious
802,2020-01-26,https://weibo.cn/comment/hot/Irk9EFMeB?rl=2,看到说舆情控制我就想笑，呵！如果一开始像河南那样处理，不用完全能学一半，也不至于这样。都在怕恐慌，都在怕舆情，可是河南宣传的那么到位，他们现在反而是全国心理最踏实的人。到处广播，到处挖断路，他们也没慌，反而井然有序。,3834,neutral
803,2020-01-26,https://weibo.cn/comment/hot/Irk9EFMeB?rl=2,建议【华南海鲜市场】日后改建为【病毒博物馆】 分几个部分展览一些野生动物携带病毒的照片标本。设立几个展馆，比如野生动物携带病毒科普馆，从SARS到冠状病毒的人类抗击病毒史馆，为此付出生命和做出重大贡献的医务人员科研人员纪念馆，让一代一代人记住一次又一次伤害野生动物造成的灾难！,2463,neutral
804,2020-01-26,https://weibo.cn/comment/hot/Irk9EFMeB?rl=2,武汉市长：问题不大，避免恐慌，可防可控,1847,angry
805,2020-01-26,https://weibo.cn/comment/hot/Irk9EFMeB?rl=2,唬弄我们不懂啊？你们武汉市委书记呢？出来走两步 别动不动就省长市长 湖北省委书记 武汉市委书记出来走两步 罚酒三杯,1398,sad
806,2020-01-26,https://weibo.cn/comment/hot/Irk9EFMeB?rl=2,他真的很辛苦的，求求大家不要喷，他真的不容易，一直坚持去一线，平时为了省口罩，连口罩都不带。在记者会为了宣传，所以才带了口罩，带反了也情有可原。,996,worry
807,2020-02-07,https://weibo.cn/comment/hot/It9nzzSag?rl=2,如果我有，我愿意捐出来，我不乱跑，普通口罩就可以了……,17535,angry
808,2020-02-07,https://weibo.cn/comment/hot/It9nzzSag?rl=2,已经缺到这种程度了…,14624,neutral
809,2020-02-07,https://weibo.cn/comment/hot/It9nzzSag?rl=2,黑龙江太难了，政府真的很努力去国外买口罩了，想出这样的政策也是没有办法了吧,6606,worry
810,2020-02-07,https://weibo.cn/comment/hot/It9nzzSag?rl=2,坐标黑龙江，我连一次性的都买不到，还n95呢，都没见过,3891,worry
811,2020-02-07,https://weibo.cn/comment/hot/It95w1pt7?rl=2,世界荒诞的不是有人吃荤，有人吃素， 而是有人吃人。,1243,angry
812,2020-02-07,https://weibo.cn/comment/hot/It95w1pt7?rl=2,太多外国势力干涉到网络上来  误导 诱导网络炸弹试图污蔑攻击政府    港独 以及台独分子 。企图借助网络的热门事件  添油加醋  诋毁我们大中华！希望大家不要被这个圈套给带进去了    相信自己国家 中国加油  武汉挺住！,1128,hopeful
813,2020-02-07,https://weibo.cn/comment/hot/It95w1pt7?rl=2,早该如此封家封户政府官员去买日用品了,587,unsatisfied
814,2020-02-07,https://weibo.cn/comment/hot/It95w1pt7?rl=2,如果一瓶结束了我吃点东西。,125,angry
815,2020-02-07,https://weibo.cn/comment/hot/It95w1pt7?rl=2,我西安现在也是封闭管理！可问题是9号收假！这下弄的我就不会了！！！上班还是不上班是个问题,12,unsatisfied
816,2020-02-07,https://weibo.cn/comment/hot/It8Rocmgp?rl=2,武汉加油，中国加油💪,287,hopeful
817,2020-02-07,https://weibo.cn/comment/hot/It8Rocmgp?rl=2,如果湖北责任人没有把握住将功补过的机会，还是早点派能者去吧,1,angry
818,2020-02-07,https://weibo.cn/comment/hot/It8Rocmgp?rl=2,我不乐意听到“加油武汉”，武汉的今天人祸＞天灾，致敬李文亮医生🕯️,245,hopeful
819,2020-02-07,https://weibo.cn/comment/hot/It8Rocmgp?rl=2,现在的新闻评论下面很多节奏，千万不要给他们带节奏了，天佑中华，众志成城，共渡难关！武汉加油！为中国加油！灾难我们一起面对，一起承受！防控疫情我们在一起,172,hopeful
820,2020-02-07,https://weibo.cn/comment/hot/It8Rocmgp?rl=2,？？？？？？,108,neutral
821,2020-02-07,https://weibo.cn/comment/hot/It8Rocmgp?rl=2,请各方的官员们好好尊重人民群众，坦诚面对人民群众。一旦工作出了差错就应该及时纠正，虚心接受人民群众的哪怕十分严厉的批评。人民群众是惹不得的，谁惹了人民群众，最终都会付出代价。,78,unsatisfied
822,2020-02-07,https://weibo.cn/comment/hot/It7A2eyxA?rl=2,太暖了吧,5897,neutral
823,2020-02-07,https://weibo.cn/comment/hot/It7A2eyxA?rl=2,好感动 这个男护士太棒了,4331,satisfied
824,2020-02-07,https://weibo.cn/comment/hot/It7A2eyxA?rl=2,这男医生绝对是个好爸爸！！！,1296,neutral
825,2020-02-07,https://weibo.cn/comment/hot/It7A2eyxA?rl=2,你还别说，这位男医生的胸脯子还挺白。,620,neutral
826,2020-02-07,https://weibo.cn/comment/hot/It7A2eyxA?rl=2,冬日里的温暖,675,moved
827,2020-02-07,https://weibo.cn/comment/hot/It7Gff4IP?rl=2,我想上学我想上学我想上学我想上学我想上学我想上学我想上学我想上学我想上学我想上学我想上学我想上学我想上学我想上学我想上学我想上学我想上学我想上学我想上学我想上学我想上学我想上学我想上学我想上学,2218,neutral
828,2020-02-07,https://weibo.cn/comment/hot/It7Gff4IP?rl=2,好想开学,2081,neutral
829,2020-02-07,https://weibo.cn/comment/hot/It7I0zwCg?rl=2,国家已经尽力了，我们一起加油,992,hopeful
830,2020-02-07,https://weibo.cn/comment/hot/It7I0zwCg?rl=2,国家没问题，烂的是蛀虫。,810,neutral
831,2020-02-07,https://weibo.cn/comment/hot/It7I0zwCg?rl=2,国家一直在努力，请看到国家的努力，请为兄弟姐妹父老乡亲加油！每个人都是我们的血肉亲人，我们共同的母亲叫中国！就算每天被坏的事情弄得很丧，母亲，家，永远都是拿来爱的！我们一起加油！,435,hopeful
832,2020-02-07,https://weibo.cn/comment/hot/It7I0zwCg?rl=2,人民日报还是人民日报吗,23,angry
833,2020-02-07,https://weibo.cn/comment/hot/It7I0zwCg?rl=2,只要还有一粒米，不往人多地方挤；只要还有一滴油，待在屋里不露头，只要还有一根葱，不往菜市场里冲；只要还有一口气，待在家里守阵地。我在家，我骄傲，我为祖国省口罩！,257,hopeful
834,2020-02-07,https://weibo.cn/comment/hot/It7I0zwCg?rl=2,对于不听话还聚餐的人或者是故意传染给他人的人是否考虑让自费治疗费用，可行吗？,79,cold
835,2020-02-07,https://weibo.cn/comment/hot/It7I0zwCg?rl=2,第一次这么想开学 开学就意味着疫情过去了,64,suspicious
836,2020-02-07,https://weibo.cn/comment/hot/It7MAwyl8?rl=2,买不到口罩、出不来了门,609,angry
837,2020-02-07,https://weibo.cn/comment/hot/It7MAwyl8?rl=2,主要能告诉我们，能在哪里买到口罩吗？,397,angry
838,2020-02-07,https://weibo.cn/comment/hot/It7MAwyl8?rl=2,大家发现没 现在不论说什么总有人抬杠？不调查某件事吧 它们疯狂刷屏,172,neutral
839,2020-02-07,https://weibo.cn/comment/hot/It7MAwyl8?rl=2,发国难财的都是魔鬼👹,93,angry
840,2020-02-07,https://weibo.cn/comment/hot/It804tEdJ?rl=2,工伤？是以身殉职吧！,14080,neutral
841,2020-02-07,https://weibo.cn/comment/hot/It804tEdJ?rl=2,道歉！！！,11829,angry
842,2020-02-07,https://weibo.cn/comment/hot/It804tEdJ?rl=2,为他正名,9057,neutral
843,2020-02-07,https://weibo.cn/comment/hot/It804tEdJ?rl=2,希望“八医吹哨”也能成为一个成语，收录在成语词典中，意为说真话，警醒世人，却被当做谣言。,9190,unsatisfied
844,2020-02-07,https://weibo.cn/comment/hot/It804tEdJ?rl=2,李医生是一位品格高尚的勇士，他的离去值得被所有人铭记。但他并不是因为说出真相而被迫害致死的，他是因为作为一名医生在接诊患者时遭受到不幸的，本质上是工伤或殉职，和他选择向公众发布真相是两个概念的事件，一个是爱岗敬业有医德的医生，一个是品格高尚的真正的勇士。希望大家能够保持理智判断。,5422,hopeful
845,2020-02-07,https://weibo.cn/comment/hot/It804tEdJ?rl=2,这是最基本的，但是不够🙏🙏🙏,2971,neutral
846,2020-02-07,https://weibo.cn/comment/hot/It804tEdJ?rl=2,有一说一，中央不是说查吗，这个工伤认定也没毛病啊...,2060,neutral
847,2020-02-07,https://weibo.cn/comment/hot/It804tEdJ?rl=2,中央已经开始查了，我们还是要相信党的，给他们点时间慢慢来啊！,1389,suspicious
848,2020-02-07,https://weibo.cn/comment/hot/It804tEdJ?rl=2,世上的事情都经不起推敲，一推敲，哪一件都藏着委屈。,1539,worry
849,2020-02-07,https://weibo.cn/comment/hot/It88e3Wag?rl=2,深圳政府反应已经太慢了，空城状态下都339例了。还要复工，酒精买不到，口罩买不到，丢示范区的脸！深圳市民真实声音！,12974,angry
850,2020-02-07,https://weibo.cn/comment/hot/It88e3Wag?rl=2,深圳这届政府，只能呵呵，挖了一年的路天天还自夸先进，挖路造gdp的套路内地都不用了，深圳这么好的资源还靠挖路。呵呵,5997,angry
851,2020-02-07,https://weibo.cn/comment/hot/It88e3Wag?rl=2,终于封闭小区了，但是为何我们还没有口罩预约,3519,neutral
852,2020-02-07,https://weibo.cn/comment/hot/It88e3Wag?rl=2,强烈要求广东特别是深圳广州延迟复工！延迟复工！延迟复工！延迟复工！延迟复工！延迟复工！延迟复工！延迟复工！延迟复工！延迟复工！延迟复工！延迟复工！延迟复工！延迟复工！延迟复工！延迟复工！延迟复工！延迟复工！延迟复工！延迟复工！延迟复工！延迟复工！延迟复工！延迟复工！,3260,neutral
853,2020-02-07,https://weibo.cn/comment/hot/It88e3Wag?rl=2,广州和深圳绝不能沦为下一个“武汉”，国家已经没有多的医护人员和医疗物资可以增援了！建议整个广东省封城两个星期，只允许生产生活物资的公司开工，其余所有人不得出门，部队直接接管，生活物资由专人统一配送！,3178,neutral
854,2020-02-07,https://weibo.cn/comment/hot/It88e3Wag?rl=2,深圳还好多人没回来呢！！！！等到回来以后地铁🚇公交都太可怕了！！！！！,2523,shock
855,2020-02-07,https://weibo.cn/comment/hot/It88e3Wag?rl=2,我们在深圳的人老老实实在家隔离到现在，可是只有有一个人出问题，全小区都要隔离。所以请深圳市立即对现在入深人员进行隔离，同时推迟不是必须行业上班时间！,1404,unsatisfied
856,2020-02-07,https://weibo.cn/comment/hot/It88e3Wag?rl=2,深圳zf防范意识很低，前几天都是物业自发的封闭式管理，zf现在才发文封闭式管理。现在空城都这么多确诊，过几天复工更可怕，而且深圳医疗条件和资源比广州差和少，爆发起来很可怕！,1320,unsatisfied
857,2020-02-07,https://weibo.cn/comment/hot/It8nZB4V2?rl=2,请给李文亮医生一个交代,456,suspicious
858,2020-02-07,https://weibo.cn/comment/hot/It8nZB4V2?rl=2,不要搞形式主义,322,neutral
859,2020-02-07,https://weibo.cn/comment/hot/It8nZB4V2?rl=2,那位说可防可控的领导呢,252,neutral
860,2020-02-07,https://weibo.cn/comment/hot/It8nZB4V2?rl=2,马书记出来挨打！！！！,139,neutral
861,2020-02-07,https://weibo.cn/comment/hot/It8nZB4V2?rl=2,李文亮医生死亡时间？,92,unsatisfied
862,2020-02-07,https://weibo.cn/comment/hot/It8nZB4V2?rl=2,都是该被钉上历史耻辱柱上的人！,93,neutral
863,2020-02-07,https://weibo.cn/comment/hot/It8Fw4ZTS?rl=2,老板要是听进去，算我输,77009,neutral
864,2020-02-07,https://weibo.cn/comment/hot/It8Fw4ZTS?rl=2,老板听得进去？？？？10号就要上班,45341,unsatisfied
865,2020-02-07,https://weibo.cn/comment/hot/It8Fw4ZTS?rl=2,职工的口罩真的也要保证了,24886,angry
866,2020-02-07,https://weibo.cn/comment/hot/It8Fw4ZTS?rl=2,企业谁来补偿。,17229,neutral
867,2020-02-07,https://weibo.cn/comment/hot/It8Fw4ZTS?rl=2,没有口罩,8497,angry
868,2020-02-07,https://weibo.cn/comment/hot/It8Fw4ZTS?rl=2,大企业，国有单位可能还能做到，那些中小企业因为这次疫情，自己能把企业艰难撑下去就不错了，还指望发工资,5894,moved
869,2020-02-07,https://weibo.cn/comment/hot/It8Fw4ZTS?rl=2,如果要出假期延期的文件，求求你们赶紧下达，明天开始都要动身复工了，不要造成了人群聚集，追悔莫及,4009,worry
870,2020-02-07,https://weibo.cn/comment/hot/It7r5geQJ?rl=2,钟老老了许多🙏,64198,neutral
871,2020-02-07,https://weibo.cn/comment/hot/It7r5geQJ?rl=2,钟老憔悴了好多……,33557,worry
872,2020-02-07,https://weibo.cn/comment/hot/It7r5geQJ?rl=2,钟南山：不能证明拐点到来，我估计这个拐点到来还得有几天！我们大家继续坚持[加油][加油]加油！,17313,hopeful
873,2020-02-07,https://weibo.cn/comment/hot/It7r5geQJ?rl=2,钟老好疲惫，要注意身体呀,13963,neutral
