,date,URL,content,numF,emotion
2764,2020-01-28,https://weibo.cn/comment/hot/IrBwrrSww?rl=2,还好没有发热 看微博这么久 我总觉得我自己也不安全,382,neutral
2765,2020-01-28,https://weibo.cn/comment/hot/IrBwrrSww?rl=2,求求各位帮帮，我爸持续发热6天，1月26日去社区查血让去医院，去了医院拍肺部ct，显示肺部有毛玻璃阴影，确诊为双肺病毒性感染，没有试剂盒不能确诊为新型冠状病毒，1月28日出现呼吸困难又去了医院，一个呼吸困难的人一天跑了三家医院都没办法安排住院，甚至连个试剂盒都没有做，医院不给安排，救命！,9,worry
2766,2020-01-28,https://weibo.cn/comment/hot/IrzzTk5Tl?rl=2,北师大的心理学专业，牛！,1095,hopeful
2767,2020-01-28,https://weibo.cn/comment/hot/IrzzTk5Tl?rl=2,顺丰已经开通了武汉捐赠的绿色通道，请有捐赠需求的朋友拨打95338专项电话与客服人员联系，请务必强调是救灾捐赠物资，经核实后会安排收寄。因为有人有物资没办法运送进去，顺丰开通了紧急通道很多人不知道 祝大家新年快乐，打扰了。,403,neutral
2768,2020-01-28,https://weibo.cn/comment/hot/IrzzTk5Tl?rl=2,希望能留给真正有需要的人。我们这种瓜子嗑多了上火，睡多了头昏的就不要去凑热闹了,251,suspicious
2769,2020-01-28,https://weibo.cn/comment/hot/IrzzTk5Tl?rl=2,我想问，有武汉来的快递怎么处理？我是买的黄冈的口罩中转武汉，过年在武汉停留了两三天，今天顺丰小哥还不当一回事儿。消毒水还没到，就套着手套，拿着普通湿巾擦了最外层的快递盒子，和口罩的外包装盒子。现在又开始想单独包装的口罩外面的塑料袋有没有事儿？然后又来了一盒广东的快递，快要崩溃了！,4,unsatisfied
2770,2020-01-28,https://weibo.cn/comment/hot/IrzzTk5Tl?rl=2,确实好多人就是喜欢胡思乱想自己把自己搞崩溃了,212,neutral
2771,2020-01-28,https://weibo.cn/comment/hot/IrAiym6Vn?rl=2,那然后我在家干啥呢 哭？,75110,neutral
2772,2020-01-28,https://weibo.cn/comment/hot/IrAiym6Vn?rl=2,这他妈政策就是脑残！现在老百姓都在家不出门已经一周了，春节也就这么过来了，还非要老百姓在家里天天看疫情报告，非要把人都逼疯了吗？！,60357,angry
2773,2020-01-28,https://weibo.cn/comment/hot/IrAiym6Vn?rl=2,那在家还能干嘛,29627,unsatisfied
2774,2020-01-28,https://weibo.cn/comment/hot/IrAiym6Vn?rl=2,没看懂，大家不能出门不更应该丰富综艺节目吗？,29100,suspicious
2775,2020-01-28,https://weibo.cn/comment/hot/IrAiym6Vn?rl=2,适量减少，毕竟大家在家太无聊了！🙏,10619,neutral
2776,2020-01-28,https://weibo.cn/comment/hot/IrAiym6Vn?rl=2,还好不禁电视剧 我还可以看下一站是幸福,5274,neutral
2777,2020-01-28,https://weibo.cn/comment/hot/IrAlr7mN9?rl=2,我实话实说啊，经济欠发达地区，医护工作者本地也挺需要的，，，现在全国都在爆发，，，浙江这么富足的地方都医院紧缺了，我觉得有些地方新疆啊，甘肃啊，什么的应该集中自己的资源先控制好省内，真的，，，我不是看不起谁，我就实话实说，雪中送炭感人，但是，得先顾好自己,10357,worry
2778,2020-01-28,https://weibo.cn/comment/hot/IrAlr7mN9?rl=2,向来自各地医护人员致敬,3903,moved
2779,2020-01-28,https://weibo.cn/comment/hot/IrAlr7mN9?rl=2,云南也渴望拥有一条微博,1966,neutral
2780,2020-01-28,https://weibo.cn/comment/hot/IrAlr7mN9?rl=2,好棒！你们一定要平安回来吃手把羊肉啊！,1273,hopeful
2781,2020-01-28,https://weibo.cn/comment/hot/IrAlr7mN9?rl=2,爱大内蒙。大家加油呀,946,hopeful
2782,2020-01-28,https://weibo.cn/comment/hot/IrAlr7mN9?rl=2,内蒙的队服是今年流行的耐克双勾啊[加油][加油][加油],657,hopeful
2783,2020-01-28,https://weibo.cn/comment/hot/IrAon8feo?rl=2,相信科学很难吗,919,unsatisfied
2784,2020-01-28,https://weibo.cn/comment/hot/IrAon8feo?rl=2,这节骨眼上还造谣的不是蠢就是坏,402,angry
2785,2020-01-28,https://weibo.cn/comment/hot/IrAon8feo?rl=2,兄弟们，我刚刚出去买东西。没有带口罩，然后路边停着一辆武汉车，我在那里停留了几秒，这样会不会被传染呢,2,worry
2786,2020-01-28,https://weibo.cn/comment/hot/IrAon8feo?rl=2,把娱乐节目停了可能要逼我们出去遛弯？,168,suspicious
2787,2020-01-28,https://weibo.cn/comment/hot/IrAon8feo?rl=2,几时能动，钟南山说动才动。,177,worry
2788,2020-01-28,https://weibo.cn/comment/hot/IrAon8feo?rl=2,家里的长辈都是真的不信，假的到处发，群里都是,85,worry
2789,2020-01-28,https://weibo.cn/comment/hot/IrAon8feo?rl=2,建议大家有些发烧症状轻的，很可能不是新型病毒传染，只是普通感冒，先在家里治疗，使劲喝热水，比去医院安全些，去医院心理压力和风险太大。,65,neutral
2790,2020-01-28,https://weibo.cn/comment/hot/IrAon8feo?rl=2,让我想起了当年的板蓝根,51,neutral
2791,2020-01-28,https://weibo.cn/comment/hot/IrAvPz0pA?rl=2,四川人民感到太高兴了,1354,excited
2792,2020-01-28,https://weibo.cn/comment/hot/IrAvPz0pA?rl=2,真的看到了中国力量，明星网红捐款，国际友人捐物，国家网电国家财政捐款出力欠电不停，所有医护人员请战，阿里给病例者贷款，病例者车贷延还，陆海军出动，公安 部队各级领导干部都奋战一线。感动感动，❤️感受到了祖国的强大。我们众志成城一定会战胜瘟疫的！,349,moved
2793,2020-01-28,https://weibo.cn/comment/hot/IrAvPz0pA?rl=2,有个问题：治好以后有抗体吗？还会感染吗,8,angry
2794,2020-01-28,https://weibo.cn/comment/hot/IrAvPz0pA?rl=2,重庆也会成为重灾区吗,1,neutral
2795,2020-01-28,https://weibo.cn/comment/hot/IrAvPz0pA?rl=2,希望未来能看到越来越多的好消息,227,hopeful
2796,2020-01-28,https://weibo.cn/comment/hot/IrAvPz0pA?rl=2,哇 成都牛逼,198,excited
2797,2020-01-28,https://weibo.cn/comment/hot/IrAvPz0pA?rl=2,四川感觉都是事情干得差不多了才说……真的是好消息！形势很严峻，后面一定要控制住！,68,satisfied
2798,2020-01-28,https://weibo.cn/comment/hot/IrAK5nYPQ?rl=2,河南奖不起 光是一个信阳都是几万人了.........,926,neutral
2799,2020-01-28,https://weibo.cn/comment/hot/IrAK5nYPQ?rl=2,购票都是实名制，为什么不从网上购票窗口查呢，何必这么残忍呢，还悬赏呢，又没有犯罪逃逸，何必搞得从武汉出来的人都像过街老鼠一样呢,13,unsatisfied
2800,2020-01-28,https://weibo.cn/comment/hot/IrAK5nYPQ?rl=2,是举报漏登的，不是每个武汉回来的！自己登记一下，自己自觉自我隔离不就没事了。。。没有那么大的恶意！我觉得做得没什么不对！,278,neutral
2801,2020-01-28,https://weibo.cn/comment/hot/IrAK5nYPQ?rl=2,光荣 要自觉,151,neutral
2802,2020-01-28,https://weibo.cn/comment/hot/IrAK5nYPQ?rl=2,不要用“悬赏”这两个字吧,7,neutral
2803,2020-01-28,https://weibo.cn/comment/hot/IrANoaTJp?rl=2,山东真的话少，但是闷声干大事,6278,worry
2804,2020-01-28,https://weibo.cn/comment/hot/IrANoaTJp?rl=2,山东寿光捐赠300吨新鲜蔬菜，且以后每日向武汉提供600吨新鲜平价蔬菜[加油],3698,moved
2805,2020-01-28,https://weibo.cn/comment/hot/IrANoaTJp?rl=2,加油！愿医护人员都平安回家,1360,hopeful
2806,2020-01-28,https://weibo.cn/comment/hot/IrANoaTJp?rl=2,我们山东真的很给力，虽然我们不怎么宣传，但是一直在默默的做好事，之前不知道为啥微博上有很多黑山东的，看了有点伤心，但是你们如果来山东，肯定会喜欢这里。山东是孔孟之乡，可能比起其他地方没有那么洋气，但是我们深受孔孟文化的影响，都比较实在，欢迎大家来山东玩，好客山东欢迎您！,1683,neutral
2807,2020-01-28,https://weibo.cn/comment/hot/IrANoaTJp?rl=2,求求你们帮下我，我妈在武汉，本来在封城前准备回来的，但是发了新闻说有潜伏期，就没回来，自觉在武汉没走，现在去医院做了肺部ct，双肺感染，求医无门，打120都不肯来，我打武汉各个医院电话没人接听，她自己去医院说没有床位现在治疗不了，求求国家，求求政府，求求大家帮帮忙，[淚][淚][淚][淚],794,worry
2808,2020-01-28,https://weibo.cn/comment/hot/IrB6OkfWu?rl=2,合理规划一线人员的工作吧！不能光歌颂他们却让他们过度工作啊,620,neutral
2809,2020-01-28,https://weibo.cn/comment/hot/IrB6OkfWu?rl=2,行吧 ，是云南不配， 别的地方一天报道好多次 ，云南呢？？云南不配，说浙江是后妈生的，那云南就是捡的，行，云南不配,2,worry
2810,2020-01-28,https://weibo.cn/comment/hot/IrBtipp41?rl=2,辛苦了，钟老,112760,worry
2811,2020-01-28,https://weibo.cn/comment/hot/IrBtipp41?rl=2,您辛苦了！！！,70986,moved
2812,2020-01-28,https://weibo.cn/comment/hot/IrBtipp41?rl=2,还是要提高警惕，不要大意,39844,neutral
2813,2020-01-28,https://weibo.cn/comment/hot/IrBtipp41?rl=2,这么看来，我离上班不远了。好事，我又能为社会主义建设做贡献了。,25331,neutral
2814,2020-01-28,https://weibo.cn/comment/hot/IrBtipp41?rl=2,大家都要平平安安健健康康的 一线的医护人员辛苦了🙏🙏🙏,14307,neutral
2815,2020-01-28,https://weibo.cn/comment/hot/IrBtipp41?rl=2,中国真幸运能有钟南山这样的爷爷,5545,hopeful
2816,2020-01-28,https://weibo.cn/comment/hot/Irz5xAbGq?rl=2,千万不能被认定疫区国。哭惹,2959,neutral
2817,2020-01-28,https://weibo.cn/comment/hot/Irz5xAbGq?rl=2,现在全国人民都想知道，到底是哪位第一个吃的蝙蝠，你想飞吗？,2247,angry
2818,2020-01-28,https://weibo.cn/comment/hot/Irz5xAbGq?rl=2,辛苦了，外交部,1641,moved
2819,2020-01-28,https://weibo.cn/comment/hot/Irz5xAbGq?rl=2,外交部不免要多费一些口舌了…,607,neutral
2820,2020-01-28,https://weibo.cn/comment/hot/Irz5xAbGq?rl=2,2003年的经验告诉我们，再复杂的情况，只要社会全面动员起来，疫情都是能够控制的。所以现在需要的不是慌张，而是坚决行动起来，调动起全社会每一个人的责任感，在疫情面前真正做到众志成城，万众一心，共度难关！,465,hopeful
2821,2020-01-28,https://weibo.cn/comment/hot/Irz5xAbGq?rl=2,我总感觉这次病毒是人为的，为何中国十多年爆发两次这种疫情?并且都是经济高度增长期。说吃野生动物传染的，那么东南亚，非洲等国家吃野生动物更加疯狂，切很少有这种病毒。希望是我多虑了，保佑我中华早日度过这场疫情。,16,neutral
2822,2020-01-28,https://weibo.cn/comment/hot/Irz5xAbGq?rl=2,有时间建议看一部电影《僵尸世界大战》2013年的，在城内安全区用扩音器集体歌唱，结果10几米的高墙都挡不住僵尸进攻！是噪音把僵尸集中起来了。,2,neutral
2823,2020-01-28,https://weibo.cn/comment/hot/Irz5xAbGq?rl=2,浙江感染人数TOP3！缺物资！！！缺400万只口罩，2万件防护服，一次性手套！！优先保障医护人员安全！！！有能力有爱心或者有渠道的求求你们了！！！浙江捐了2000多万只口罩没给自己留后路！！！,235,worry
2824,2020-01-27,https://weibo.cn/comment/hot/Irt6Ivfe1?rl=2,海南自己疫情也挺严重的啊,1384,satisfied
2825,2020-01-27,https://weibo.cn/comment/hot/Irt6Ivfe1?rl=2,海南现在也很严重啊……,516,neutral
2826,2020-01-27,https://weibo.cn/comment/hot/Irt6Ivfe1?rl=2,云南不能拥有姓名吗,348,neutral
2827,2020-01-27,https://weibo.cn/comment/hot/Irt6Ivfe1?rl=2,云南好多贫困县，我今天跑了十个药店买不到一个口罩和体温计。整个县城很少有人戴口罩。老逼火了,181,suspicious
2828,2020-01-27,https://weibo.cn/comment/hot/Irt6Ivfe1?rl=2,江西的也去了，望所有人都平平安安的归来,150,hopeful
2829,2020-01-27,https://weibo.cn/comment/hot/Irt6Ivfe1?rl=2,加油平安健康！！！！！！！！！！,1,hopeful
2830,2020-01-27,https://weibo.cn/comment/hot/Irt6Ivfe1?rl=2,平平安安的，本海南人希望小岛也是，等好起来了欢迎大家来小岛玩～,126,hopeful
2831,2020-01-27,https://weibo.cn/comment/hot/IrsGd0qbZ?rl=2,给劳资听好了，看到这条评论的都感染不上新型冠状病毒,4504,neutral
2832,2020-01-27,https://weibo.cn/comment/hot/IrsGd0qbZ?rl=2,武汉市委书记终于露面了,3061,excited
2833,2020-01-27,https://weibo.cn/comment/hot/IrsGd0qbZ?rl=2,湖北版的高育良啊，咱们湖北的这事真的要遗臭万年了，离开的500万人，其实有很多是学生和务工人员，正常反乡，因为政府隐瞒情况，他们也是无辜的。坑爹的是吃野味的人和不作为的领导以及带病逃离的人……,1524,worry
2834,2020-01-27,https://weibo.cn/comment/hot/IrsGd0qbZ?rl=2,华南市场余甜，我想听这个,1226,unsatisfied
2835,2020-01-27,https://weibo.cn/comment/hot/IrsGd0qbZ?rl=2,知道为什么疫情控制不住了，因为疫情工作发布会，开场五分钟了，马书记一直说着官话虚话空话。。。。看看王岐山17年前做北京市长时做的发布会。能力水平差的太远。,1281,satisfied
2836,2020-01-27,https://weibo.cn/comment/hot/IrsGd0qbZ?rl=2,请听题： 湖北省省长所说的各类口罩的年生产能力有多少？ A：108亿只   B：18亿只   C：108万只   D：18万只！！！,411,angry
2837,2020-01-27,https://weibo.cn/comment/hot/Irt9FrUAe?rl=2,西藏啊你要挺住！！！,19258,hopeful
2838,2020-01-27,https://weibo.cn/comment/hot/Irt9FrUAe?rl=2,西藏加油 最后的净土！！！！,15275,hopeful
2839,2020-01-27,https://weibo.cn/comment/hot/Irt9FrUAe?rl=2,看看人家西藏，没有病例都二级！！,14232,neutral
2840,2020-01-27,https://weibo.cn/comment/hot/Irt9FrUAe?rl=2,保护我方鸡屁股🙏,11722,neutral
2841,2020-01-27,https://weibo.cn/comment/hot/Irt9FrUAe?rl=2,西藏:防患于未然  我也有点怕,8289,neutral
2842,2020-01-27,https://weibo.cn/comment/hot/Irt9FrUAe?rl=2,西藏啊你要挺住！！！,868,hopeful
2843,2020-01-27,https://weibo.cn/comment/hot/IrtglqJXs?rl=2,我们也买不到啊,1471,neutral
2844,2020-01-27,https://weibo.cn/comment/hot/IrtglqJXs?rl=2,不好意思，我也是湖北的，最近都在说防护服紧缺，特意关注了一下各个医院报的防护服的数量，仙桃作为一个省直管县，仅第一医院就报需要10万套防护服？而孝感属地级市，三家医院的防护服需求量加一起才一万五？这个差距是否太大？基层报的量究竟是否合理？,225,angry
2845,2020-01-27,https://weibo.cn/comment/hot/IrtglqJXs?rl=2,#余甜#借楼 麻烦各位关注一下余甜（华南海鲜市场幕后老板）热搜一直被压 不能让这位一姐逍遥法外！！,416,suspicious
2846,2020-01-28,https://weibo.cn/comment/hot/Irx3e9rNI?rl=2,保护一方净土🙏🙏🙏,1553,neutral
2847,2020-01-28,https://weibo.cn/comment/hot/Irx3e9rNI?rl=2,吃野味的都是一些有点臭钱的人，普通的牛羊鸡鸭鱼他们都厌了，所以才乱吃的，咋不去吃S呢。,293,angry
2848,2020-01-28,https://weibo.cn/comment/hot/Irx3e9rNI?rl=2,因为都知道西藏没有，就以为到西藏就安全了。。。,321,neutral
2849,2020-01-28,https://weibo.cn/comment/hot/Irx3e9rNI?rl=2,西藏挺住 加油,4,hopeful
2850,2020-01-28,https://weibo.cn/comment/hot/Irx3e9rNI?rl=2,西藏关闭所有旅游景点，干的漂亮！,185,satisfied
2851,2020-01-28,https://weibo.cn/comment/hot/Irx3e9rNI?rl=2,这时候都尽最大的可能杜绝交叉感染吧，西藏做得好，保护我们最后的净土,77,neutral
2852,2020-01-28,https://weibo.cn/comment/hot/Irx3e9rNI?rl=2,看看西藏这警觉性,62,neutral
2853,2020-01-28,https://weibo.cn/comment/hot/IrxjvgpHu?rl=2,祖国一直都值得相信，只是某些官员乱了章法,916,neutral
2854,2020-01-28,https://weibo.cn/comment/hot/IrxjvgpHu?rl=2,这钱得让余家掏,6,angry
2855,2020-01-28,https://weibo.cn/comment/hot/IrxjvgpHu?rl=2,27号的全国确诊人数怎么不更新了？,1,suspicious
2856,2020-01-28,https://weibo.cn/comment/hot/IrxjvgpHu?rl=2,不是免费治疗吗？咋还自付,2,neutral
2857,2020-01-28,https://weibo.cn/comment/hot/IrxjvgpHu?rl=2,出生时那年非典，高考这年遇上病毒… 这都是些什么事？,100,neutral
2858,2020-01-28,https://weibo.cn/comment/hot/IrxjvgpHu?rl=2,庆幸自己生在值得相信的国家,74,excited
2859,2020-01-28,https://weibo.cn/comment/hot/IrxjvgpHu?rl=2,以后的每天希望都是好消息🙏,59,satisfied
2860,2020-01-28,https://weibo.cn/comment/hot/IrxjvgpHu?rl=2,全国累计病例最新数据怎么还不更新,58,suspicious
2861,2020-01-28,https://weibo.cn/comment/hot/IrxIpcw1H?rl=2,停留数分钟…？？？,343,neutral
2862,2020-01-28,https://weibo.cn/comment/hot/IrxIpcw1H?rl=2,我大吉林撑住！！！！,242,shock
2863,2020-01-28,https://weibo.cn/comment/hot/IrxIpcw1H?rl=2,吉林加油，吉林挺住啊！,259,hopeful
2864,2020-01-28,https://weibo.cn/comment/hot/IrxIpcw1H?rl=2,公主岭市首发病例：女，50岁，是2020年1月17日乘坐T182次列车从湖北仙桃市返回长春的旅客之一，到达长春后转乘长春至怀德的客车，中途换乘车辆到怀德镇三合堡村8组。经排查，1月27日收入定点医疗机构隔离治疗，初步诊断为普通轻型病例。,10,neutral
2865,2020-01-28,https://weibo.cn/comment/hot/IrxIpcw1H?rl=2,昨晚做梦，梦到疫情过去了，举国欢庆，还拍了个电影来纪念，真好,152,worry
2866,2020-01-28,https://weibo.cn/comment/hot/IrxIpcw1H?rl=2,东北F4挺住！,97,neutral
2867,2020-01-28,https://weibo.cn/comment/hot/Iry985AuU?rl=2,昨晚做梦，梦到疫情过去了，举国欢庆，还拍了个电影来纪念，真好,337,worry
2868,2020-01-28,https://weibo.cn/comment/hot/Iry985AuU?rl=2,❗️❗️❗️请报道一下昆明被空投119名武汉人行吗，请重视起来，还有云南支援的物资和派去的医生也请报道一下❗️❗️❗️请一视同仁，云南不配拥有姓名吗,145,unsatisfied
2869,2020-01-28,https://weibo.cn/comment/hot/Iry985AuU?rl=2,假如能抓到那些吃野味的最严重的惩罚是什么？,10,angry
2870,2020-01-28,https://weibo.cn/comment/hot/Iry985AuU?rl=2,回答的还是很清晰的.国家卫健委的发布会比湖北发布会有水平多了.记者问的问题也好.回答的也很清楚.而且看得出是了解情况的.没有照稿子念了,6,unsatisfied
2871,2020-01-28,https://weibo.cn/comment/hot/Iry985AuU?rl=2,吃野味的都是一些有点臭钱的人，普通的牛羊鸡鸭鱼他们都厌了，所以才乱吃的，咋不去吃S呢。,72,angry
2872,2020-01-28,https://weibo.cn/comment/hot/Iry985AuU?rl=2,如果您来自疫区，您曾到过武汉，或接触过从武汉回来者，请不要去接触别人，请自觉居家观察14天！ 请家人不参与社会活动，不待客！这是觉悟也是责任，关乎您和您家人及全社会的健康❗,58,shock
2873,2020-01-28,https://weibo.cn/comment/hot/IryM9h5QN?rl=2,河南这次真的很牛逼了，既让全国网民有笑点，还保证了自己村里的安全,24698,excited
2874,2020-01-28,https://weibo.cn/comment/hot/IryM9h5QN?rl=2,这几天我已经学了好多河南话了,16035,neutral
2875,2020-01-28,https://weibo.cn/comment/hot/IryM9h5QN?rl=2,河南和浙江对比太明显了，笑死,14105,angry
2876,2020-01-28,https://weibo.cn/comment/hot/IryM9h5QN?rl=2,虽然俺是河北的。但是俺觉的河南喇叭🎺喊的不错,7234,satisfied
2877,2020-01-27,https://weibo.cn/comment/hot/IrsmUjc8f?rl=2,也请离汉人员自觉隔离啊啊啊啊啊,6225,unsatisfied
2878,2020-01-27,https://weibo.cn/comment/hot/IrsmUjc8f?rl=2,也请这500万离汉人员自觉点，别出去浪跑了，找个地方自己窝半个月吧,4596,angry
2879,2020-01-27,https://weibo.cn/comment/hot/IrsmUjc8f?rl=2,dbq 今天看了那个什么徐小柚子的微博我真的恐鄂,1748,worry
2880,2020-01-27,https://weibo.cn/comment/hot/IrsmUjc8f?rl=2,但是不包括恶意逃跑，吃退烧药躲避检测的湖北人,1591,angry
2881,2020-01-27,https://weibo.cn/comment/hot/IrsmUjc8f?rl=2,现在带节奏地域黑湖北的清一色的垃圾账号！！,933,angry
2882,2020-01-27,https://weibo.cn/comment/hot/IrsmUjc8f?rl=2,可是谎报的人真的没有❤️，谎报回家时间，并且不自行隔离，置无辜的人的生命安全于何地？？？？？？？？？？？,795,angry
2883,2020-01-27,https://weibo.cn/comment/hot/IrqSXCZNr?rl=2,比想象中动作迅速完善。挺感谢媒体这次都公布 让我们都看到啦...希望天佑中华早日度过,2938,hopeful
2884,2020-01-27,https://weibo.cn/comment/hot/IrqSXCZNr?rl=2,好消息！,1385,excited
2885,2020-01-27,https://weibo.cn/comment/hot/IrqSXCZNr?rl=2,我家是农村的，自己种了很多白菜都吃不完，很多都浪费了，知道重庆武汉现在粮食缺乏，想把这些白菜运输到重庆武汉去，但是我不知道怎么送过去，毕竟要包一辆车的话，我家里也承担不起运费，所以求大家帮帮忙，送我上去呀，有方法的直接联系我呀🙏🙏🙏求帮忙求转发,521,angry
2886,2020-01-27,https://weibo.cn/comment/hot/IrqSXCZNr?rl=2,下一条消息：成功研制出治疗新型肺炎药物,13,hopeful
2887,2020-01-27,https://weibo.cn/comment/hot/IrqSXCZNr?rl=2,重庆加油！！好消息！！！重庆赶紧的赶紧的！！！！,1,satisfied
2888,2020-01-27,https://weibo.cn/comment/hot/IrqSXCZNr?rl=2,好消息会越来越多的,3,excited
2889,2020-01-27,https://weibo.cn/comment/hot/IrqSXCZNr?rl=2,好消息,222,excited
2890,2020-01-27,https://weibo.cn/comment/hot/IrqYaAiW2?rl=2,太好了太好了太好了太好了太好了太好了太好了太好了太好了太好了太好了太好了太好了太好了太好了太好了太好了太好了太好了太好了太好了太好了太好了太好了太好了太好了,1503,neutral
2891,2020-01-27,https://weibo.cn/comment/hot/IrqSXCZNr?rl=2,好消息越来越多了！,172,excited
2892,2020-01-27,https://weibo.cn/comment/hot/IrqSXCZNr?rl=2,黄冈加油！！,118,hopeful
2893,2020-01-27,https://weibo.cn/comment/hot/IrqSXCZNr?rl=2,好消息,48,excited
2894,2020-01-27,https://weibo.cn/comment/hot/IrqYaAiW2?rl=2,好！！！,649,neutral
2895,2020-01-27,https://weibo.cn/comment/hot/IrqYaAiW2?rl=2,#请暂停青岛外卖#台东！和兴路“新隆嘉”超市被查封。 饿了么送餐员 : 刘军有 ，13号从武汉回来，14号到25号一直在台东送餐！ 他妻子在新隆嘉超市上班，均已经确诊！ 大家这段时间有饿了么订外卖的可以看看饿了么订单派送的送餐员是谁，注意观察，及时隔离，对自己和他人负责！ ,111,unsatisfied
2896,2020-01-27,https://weibo.cn/comment/hot/IrqYaAiW2?rl=2,好消息,295,excited
2897,2020-01-27,https://weibo.cn/comment/hot/IrqYaAiW2?rl=2,太好了！希望接下来都是好消息,259,satisfied
2898,2020-01-27,https://weibo.cn/comment/hot/IrqYaAiW2?rl=2,有些人因为戴口罩难看就没戴，然后还外出，聚集在一起喝酒打麻将，这种情况该不该举报啊？,2,neutral
2899,2020-01-27,https://weibo.cn/comment/hot/IrqYaAiW2?rl=2,加油💪山东！会好的！都会好的！中国加油！  ,227,hopeful
2900,2020-01-27,https://weibo.cn/comment/hot/IrqYaAiW2?rl=2,山东人民！加油！奥利给！,150,hopeful
2901,2020-01-27,https://weibo.cn/comment/hot/IrqYaAiW2?rl=2,真好，是好消息,100,excited
2902,2020-01-27,https://weibo.cn/comment/hot/IrqYaAiW2?rl=2,好消息!,52,excited
2903,2020-01-27,https://weibo.cn/comment/hot/Irr9dAywz?rl=2,大山东赞👍🏻,11785,neutral
2904,2020-01-27,https://weibo.cn/comment/hot/Irr9dAywz?rl=2,这是好事啊！！不过……哥哥  你能不能别把重要消息攒在晚上发？昨个你一宿没睡我们也睡不着啊,7913,excited
2905,2020-01-27,https://weibo.cn/comment/hot/Irr9dAywz?rl=2,山东这几天的反应我真的要为你打call！！,8062,worry
2906,2020-01-27,https://weibo.cn/comment/hot/Irr9dAywz?rl=2,愿我大山东永无灾难,3984,hopeful
2907,2020-01-27,https://weibo.cn/comment/hot/Irr9dAywz?rl=2,全国严禁吧！,2703,neutral
2908,2020-01-27,https://weibo.cn/comment/hot/Irr9dAywz?rl=2,山东人一般不会吃野生动物，严于律己啊，从始至终都做的很好，国家不让吃，就不吃，大葱大蒜白菜萝卜土豆的，猪羊牛鸡鸭鹅肉，是吃不饱还是不香？真的不理解南方人吃野味的,1176,angry
2909,2020-01-27,https://weibo.cn/comment/hot/Irrisg9li?rl=2,卧槽,3887,neutral
2910,2020-01-27,https://weibo.cn/comment/hot/Irrisg9li?rl=2,几个管不住嘴的憨批不知道让国家损失了多少钱,2726,neutral
2911,2020-01-27,https://weibo.cn/comment/hot/Irrisg9li?rl=2,希望落到实处🙏,1388,hopeful
2912,2020-01-27,https://weibo.cn/comment/hot/Irrisg9li?rl=2,吃野味让中央赔这么多钱,1589,angry
2913,2020-01-27,https://weibo.cn/comment/hot/Irrisg9li?rl=2,本来会拿去扶贫的是吗,987,neutral
2914,2020-01-27,https://weibo.cn/comment/hot/Irrisg9li?rl=2,划重点“任何地方和部门不得擅自截留、挤占、挪用或改变资金使用用途”,940,neutral
2915,2020-01-27,https://weibo.cn/comment/hot/Irrisg9li?rl=2,真的这月经济要下降了。,813,worry
2916,2020-01-27,https://weibo.cn/comment/hot/Irrisg9li?rl=2,这都是2020的GDP啊……还是全面小康的决胜年，为几个吃野味的真的不值当,769,angry
2917,2020-01-27,https://weibo.cn/comment/hot/Irrisg9li?rl=2,希望每一分钱都花到实处,580,hopeful
