,date,URL,content,numF,emotion
1764,2020-02-03,https://weibo.cn/comment/hot/IssQuit0z?rl=2,务必保证一线医护人员物资充足！！,2324,worry
1765,2020-02-03,https://weibo.cn/comment/hot/IssQuit0z?rl=2,很多粉丝担心我的直言不讳，会有麻烦，会被封号，被关小黑屋；我认为国家有难，匹夫有责，有啥怕的？做人就一回怕什么？就这么怕当官的？当官的只不过是国民税收雇佣的工作人员，怕他作甚？我们中国人骨子里的奴性自己都去不掉嘛？,1428,sad
1766,2020-02-03,https://weibo.cn/comment/hot/IsrbkqHLq?rl=2,中国人民解放军，相信你们🙏,13697,neutral
1767,2020-02-03,https://weibo.cn/comment/hot/IsrbkqHLq?rl=2,听军人说话简洁明了铿锵有力。看湖北的庸官吭哧吭哧半天，说不出个所以然来，都是打太极…,12243,angry
1768,2020-02-03,https://weibo.cn/comment/hot/IsrbkqHLq?rl=2,看到他们出来突然就想哭了，等了那么久都看不到希望，现在解放军出来了，突然觉得看到希望，明明一开始就应该可以控制住的，明明可以防患于未然的，发展到现在这个样子，谁该为瞒报的单位买单的？这样的话中国的经济又得有多大的损失？中国能发展到今天不容易，就让某些人的无知糟蹋了,3343,suspicious
1769,2020-02-03,https://weibo.cn/comment/hot/IsrbkqHLq?rl=2,然后呢？换人管理就算把全国人民糊弄过去了？他们不把党中央，全国人民放眼里，还有人包庇他们？那么是不是犯罪贪污腐败，挪用公款，都不用负法律责任，因为后台够硬！,2448,satisfied
1770,2020-02-03,https://weibo.cn/comment/hot/IsrbkqHLq?rl=2,都是被红十字会逼得,1099,angry
1771,2020-02-03,https://weibo.cn/comment/hot/IsrbkqHLq?rl=2,说实话，别老说刷屏刷车牌号红十字烦，这还是有点效果的至少让民企接管了，你要不说憋死也没人管，舆论的压力还是很重要的,749,neutral
1772,2020-02-03,https://weibo.cn/comment/hot/IsrcOC9no?rl=2,重庆买不到口罩🙏,2054,angry
1773,2020-02-03,https://weibo.cn/comment/hot/IsrcOC9no?rl=2,红十会的事总得有个结果吧,558,worry
1774,2020-02-03,https://weibo.cn/comment/hot/IsrcOC9no?rl=2,重庆小面加油 兰州牛肉面给你加油,465,hopeful
1775,2020-02-03,https://weibo.cn/comment/hot/IsrcOC9no?rl=2,重庆能不能公布一下每个区县病例的活动轨迹啊！！！！！昨天就公布了一部分区县，一直这么遮遮掩掩要到什么时候？？！！！！！！,408,neutral
1776,2020-02-03,https://weibo.cn/comment/hot/IsrcOC9no?rl=2,我要实名制举报，奥园康城小区里面有人打麻将 。TMD,381,unsatisfied
1777,2020-02-03,https://weibo.cn/comment/hot/IsrcOC9no?rl=2,我们北碚这片净土一定要撑住啊！,356,neutral
1778,2020-02-03,https://weibo.cn/comment/hot/Isrph1Cco?rl=2,解放军大规模加入一线战斗，这是最令人振奋的好消息！,3382,excited
1779,2020-02-03,https://weibo.cn/comment/hot/Isrph1Cco?rl=2,中国人🇨🇳,1799,neutral
1780,2020-02-03,https://weibo.cn/comment/hot/Isrph1Cco?rl=2,自古乱世出英雄，这次疫情让我们看到了平凡生活里不平凡的英雄,1450,moved
1781,2020-02-03,https://weibo.cn/comment/hot/Isrph1Cco?rl=2,经过这次事情，真的发现，普通老百姓才是最可爱的，最最最可爱的！！人民才是最可爱的，最最最可爱的！！！,775,angry
1782,2020-02-03,https://weibo.cn/comment/hot/IsrK10LJ8?rl=2,安徽加油安徽加油安徽加油,234,hopeful
1783,2020-02-03,https://weibo.cn/comment/hot/IsrK10LJ8?rl=2,现在的多，应该就是之前那些疑似确诊了，还有就是封城之前，交叉感染的人群爆发了。封城之后大家都注意了，过了这周应该就好多了。,140,unsatisfied
1784,2020-02-03,https://weibo.cn/comment/hot/IsrK10LJ8?rl=2,救救蚌埠吧🙏,63,worry
1785,2020-02-03,https://weibo.cn/comment/hot/IsrK10LJ8?rl=2,安徽一定要挺住，安徽人顶起来🙏🙏🙏,119,hopeful
1786,2020-02-03,https://weibo.cn/comment/hot/IsrK10LJ8?rl=2,很多粉丝担心我的直言不讳，会有麻烦，会被封号，被关小黑屋；我认为国家有难，匹夫有责，有啥怕的？做人就一回怕什么？就这么怕当官的？当官的只不过是国民税收雇佣的工作人员，怕他作甚？我们中国人骨子里的奴性自己都去不掉嘛？,103,sad
1787,2020-02-03,https://weibo.cn/comment/hot/IsrYGuwmc?rl=2,应该入选感动中国人物，让更多老百姓知道他的感人事迹,10804,moved
1788,2020-02-03,https://weibo.cn/comment/hot/IsrYGuwmc?rl=2,医护人员辛苦了🙏,6446,moved
1789,2020-02-03,https://weibo.cn/comment/hot/IsrYGuwmc?rl=2,很多粉丝担心我的直言不讳，会有麻烦，会被封号，被关小黑屋；我认为国家有难，匹夫有责，有啥怕的？做人就一回怕什么？就这么怕当官的？当官的只不过是国民税收雇佣的工作人员，怕他作甚？我们中国人骨子里的奴性自己都去不掉嘛？,2072,sad
1790,2020-02-03,https://weibo.cn/comment/hot/IsrYGuwmc?rl=2,感动世界！,1107,moved
1791,2020-02-03,https://weibo.cn/comment/hot/IsrYGuwmc?rl=2,希望早日恢复平静。。就可以结算下病毒翻出来的每一笔账,888,hopeful
1792,2020-02-03,https://weibo.cn/comment/hot/IsrYGuwmc?rl=2,武汉金银潭医院🐮！！已经治愈了赶多病人，相信治愈出院的人数一定会越来越多,670,hopeful
1793,2020-02-03,https://weibo.cn/comment/hot/IsskQwngV?rl=2,病毒不可怕，可怕的是人心。一部分人，盲目跟风，混淆视听。一些机构，管理不善，漏洞百出。个别媒体胡说八道，乱带节奏！一会权威发布，一会相互辟谣。有多少在前线医护人员得不到最基本保障，医护人员照顾好自己，家人在等你们凯旋，我们要相信国家相信政府！切记：不要被不怀好意的人混淆视听！,1309,unsatisfied
1794,2020-02-03,https://weibo.cn/comment/hot/IsskQwngV?rl=2,务必保证一线医护人员物资充足！,810,worry
1795,2020-02-03,https://weibo.cn/comment/hot/IsskQwngV?rl=2,务必保证一线医护人员物资充足！保护好他们,468,worry
1796,2020-02-03,https://weibo.cn/comment/hot/IsskQwngV?rl=2,请求大家关注肺炎患者求助超话，活生生的人太无助可怜了。,365,worry
1797,2020-02-03,https://weibo.cn/comment/hot/IsskQwngV?rl=2,希望能对民众的问题有合理回应！,363,hopeful
1798,2020-02-03,https://weibo.cn/comment/hot/IsskQwngV?rl=2,2020 国泰民安  ，一帆风顺！相信祖国，相信我们自己，一定可以扛过这次的疫情🙏 加油加油加油[加油],10,hopeful
1799,2020-02-03,https://weibo.cn/comment/hot/IsskQwngV?rl=2,黑死病给欧洲带来了资本主义的萌芽，希望这次肺炎能给我们带来社会主义的民主，自由，平等和公正[加油],344,angry
1800,2020-02-03,https://weibo.cn/comment/hot/IssDeA2lh?rl=2,终于公布了,4394,excited
1801,2020-02-03,https://weibo.cn/comment/hot/IssDeA2lh?rl=2,国际庄要么一言不发，要么一鸣惊人。但是第二例，请追究责任，没有目的，就是为了来石就医么？,4231,neutral
1802,2020-02-03,https://weibo.cn/comment/hot/IssDeA2lh?rl=2,第二例已经在武汉就诊了又跑出来是几个意思,2240,angry
1803,2020-02-03,https://weibo.cn/comment/hot/IssDeA2lh?rl=2,我们河北每天都有找人。,978,neutral
1804,2020-02-03,https://weibo.cn/comment/hot/IssDeA2lh?rl=2,第2 5 9 10例都感觉都是逃到石家庄的...,985,neutral
1805,2020-02-03,https://weibo.cn/comment/hot/IssDeA2lh?rl=2,为了求生来外地求医我能理解，但那些明知道自己感染了还坐公共交通工具什么意思？说实话，这几例里自驾来河北的我都觉得没问题，坐火车就是活该被骂,461,angry
1806,2020-02-03,https://weibo.cn/comment/hot/IssDeA2lh?rl=2,二，四，五，九绝对是明知感染故意跑来的，尤其第二例，少跟我说什么他们也很可怜，针不扎到你身上你不知道疼，那么有同理心建议都领你家，一路上不知道要感染多少人他们不可怜吗？,715,neutral
1807,2020-02-03,https://weibo.cn/comment/hot/IssM6uk82?rl=2,1.有的人是真的想让国家重视这个事并解决。2.有的人只想蹭热度，不关心事件本身和其他每一条新闻。3.公知和有心人故意的。4.被公知带偏的大众跟着故意的。5.装好人带偏。与物资和医护人员无关，希望大家坚守住我们的1发声，提防2345，让上面看到我们真正的意愿。,1051,unsatisfied
1808,2020-02-03,https://weibo.cn/comment/hot/IssM6uk82?rl=2,希望可以投放一些普通口罩到市场，之前买的快用完了，马上开学开班了，买不到啊。,646,worry
1809,2020-02-03,https://weibo.cn/comment/hot/IssM6uk82?rl=2,大白天的见鬼，而且还是大G鬼。不知道是大G女本人还是她亲人，私聊找我掐架，哈哈哈。一样都是“剑”人,121,neutral
1810,2020-02-03,https://weibo.cn/comment/hot/IssM6uk82?rl=2,说到菜山东人心寒！,106,neutral
1811,2020-02-03,https://weibo.cn/comment/hot/IssM6uk82?rl=2,菜市场的人都买不到口罩的话怎么办？,80,angry
1812,2020-02-03,https://weibo.cn/comment/hot/IssM6uk82?rl=2,上联:火神山，雷神山，钟南山，三山齐聚克难关 。下联:国内捐，海外捐，李兰娟，众捐纷来达通途。横批:武汉必胜，中国🇨🇳必胜！,32,hopeful
1813,2020-02-03,https://weibo.cn/comment/hot/IssPe2nMV?rl=2,想要中国经济好，湖北政委先下倒，想要中国经济强，湖北红十去它娘。,59390,angry
1814,2020-02-03,https://weibo.cn/comment/hot/IssPe2nMV?rl=2,2020年唯一目标（活着）🙏,25496,worry
1815,2020-02-03,https://weibo.cn/comment/hot/IssPe2nMV?rl=2,1.有的人是真的想让国家重视这个事并解决。2.有的人只想蹭热度，不关心事件本身和其他每一条新闻。3.公知和有心人故意的。4.被公知带偏的大众跟着故意的。5.装好人带偏。与物资和医护人员无关，希望大家坚守住我们的1发声，提防2345，让上面看到我们真正的意愿。,9874,unsatisfied
1816,2020-02-03,https://weibo.cn/comment/hot/IssPe2nMV?rl=2,这个冬天，比往年更寒、更冷。  但是啊！  没有一个冬天不可逾越， 请相信，春天一定在来的路上。  待凛冬离去，雪融草青， 一定有新的相逢将温暖延续。,6230,hopeful
1817,2020-02-03,https://weibo.cn/comment/hot/IssPe2nMV?rl=2,今天股票3000多个跌停啊！,3563,neutral
1818,2020-02-03,https://weibo.cn/comment/hot/IssPe2nMV?rl=2,今年这半年的GDP就打了水票了 很多中小企业撑不下去就直接倒了,3125,neutral
1819,2020-02-03,https://weibo.cn/comment/hot/IssPe2nMV?rl=2,这一切都还要从吃蝙蝠的那群憨批说起……,2989,angry
1820,2020-02-03,https://weibo.cn/comment/hot/IssPe2nMV?rl=2,影响到我赚钱还花呗了。,1682,neutral
1821,2020-02-02,https://weibo.cn/comment/hot/IsokQmJAV?rl=2,向最美的逆行者致敬，共同抗击疫情，一起为武汉加油，为中国加油！,1304,hopeful
1822,2020-02-02,https://weibo.cn/comment/hot/IsokQmJAV?rl=2,中国加油 武汉加油💪,968,hopeful
1823,2020-02-02,https://weibo.cn/comment/hot/IsokQmJAV?rl=2,坚信爱会赢！武汉加油啊！,695,hopeful
1824,2020-02-02,https://weibo.cn/comment/hot/IsokQmJAV?rl=2,加油 众志成城 我们一定会赢！,398,hopeful
1825,2020-02-02,https://weibo.cn/comment/hot/IsokQmJAV?rl=2,严查红十字会严查红十字会,385,angry
1826,2020-02-02,https://weibo.cn/comment/hot/IsokQmJAV?rl=2,舆论压力要给足，对中央的信任更要给足！天灾人祸面前，唯有团结在党中央周围才能战胜邪恶！,251,hopeful
1827,2020-02-02,https://weibo.cn/comment/hot/IsokQmJAV?rl=2,武汉加油！中国加油！！[加油][加油],210,hopeful
1828,2020-02-02,https://weibo.cn/comment/hot/IsokQmJAV?rl=2,这个视频真的蛮感动的！哎,192,moved
1829,2020-02-02,https://weibo.cn/comment/hot/IsokQmJAV?rl=2,武汉加油！中国加油！有爱就会赢！一切都会好起来的！,180,hopeful
1830,2020-02-02,https://weibo.cn/comment/hot/Ism4aAOME?rl=2,就没见过这么不省心,14556,neutral
1831,2020-02-02,https://weibo.cn/comment/hot/Ism4aAOME?rl=2,山东人表示tm初一就开始封村，过亿人的大省控制现在这样已经很不错了。而且大部分是同事，家庭一家人那种，而且好多都是武汉回来的，山东只是全部发布出来。同事是放年假前，了解一下日期不行吗？咋还tm地域黑了呢,8765,angry
1832,2020-02-02,https://weibo.cn/comment/hot/Ism4aAOME?rl=2,我山东太难了🙏,4504,worry
1833,2020-02-02,https://weibo.cn/comment/hot/Ism4aAOME?rl=2,山东人感染230 人口一个亿➕ 贡献蔬菜 没有人有资格说山东人的不是 吃野味的惹出来的货 凭什么让山东承担骂名,3711,angry
1834,2020-02-02,https://weibo.cn/comment/hot/Ism4aAOME?rl=2,14例无症状感染者？？这个更恐怖吧,2702,unsatisfied
1835,2020-02-02,https://weibo.cn/comment/hot/Ism4aAOME?rl=2,起标题的媒体人可以直接下岗了。大部分网友看了标题都会想当然以为是新增60起。然后就会有人对山东人扣不听管教的帽子。为啥要用发现这个词呢？哪怕改成“分析发现”也好啊。（友情加个数据：山东一亿多人口，确诊230例。要地域黑的先对比一下自己省份再说话,1356,angry
1836,2020-02-02,https://weibo.cn/comment/hot/IsmGcBJnV?rl=2,红十字会牛皮  加油你们是最垃圾的,2501,angry
1837,2020-02-02,https://weibo.cn/comment/hot/IsmGcBJnV?rl=2,提一个建议。 这次疫情过后，请把华南海鲜市场夷为平地，原址建设武汉2019-nCoV病毒感染事件受害者纪念馆，记录2020年初发生的大事。将因感染致病的案例展示出来。作为向公众教育之用，希望再没有人吃野味。两次了，有点记性吧,1677,angry
1838,2020-02-02,https://weibo.cn/comment/hot/IsmGcBJnV?rl=2,向奋战在一线的防疫工作者致敬！,1000,moved
1839,2020-02-02,https://weibo.cn/comment/hot/IsmGcBJnV?rl=2,多看看新闻联播，明天又是美好的一天,785,hopeful
1840,2020-02-02,https://weibo.cn/comment/hot/IsmGcBJnV?rl=2,后边一句听起来中央很生气：湖北省要做好医疗防控物资管理、优化使用。,580,neutral
1841,2020-02-02,https://weibo.cn/comment/hot/IsmGcBJnV?rl=2,10字贿的问题问责了？,417,neutral
1842,2020-02-02,https://weibo.cn/comment/hot/IsmPktxtf?rl=2,我们能做的，就是尽量传播正能量，对于负能量，可以监督，国务院、公检法的举报途径一直在。但是不要把奋战在一线那么多人的努力，用三两句话和几幅图片就轻易否定了，更不要在毫无相关的微博内容下刷屏盖掉多数人的需求。不信谣，不传谣，有能力就帮助出力，没有能力也别拖后腿。愿一切都快快好起来。,2475,hopeful
1843,2020-02-02,https://weibo.cn/comment/hot/IsmPktxtf?rl=2,口罩呢！！！！！说好n95给一线呢！！！！！！,2305,angry
1844,2020-02-02,https://weibo.cn/comment/hot/IsmPktxtf?rl=2,红十的东西什么时候能吐出来,2171,worry
1845,2020-02-02,https://weibo.cn/comment/hot/IsmPktxtf?rl=2,红十字会必死,1858,angry
1846,2020-02-02,https://weibo.cn/comment/hot/IsmPktxtf?rl=2,武汉红十字会解散没,947,angry
1847,2020-02-02,https://weibo.cn/comment/hot/IsmPktxtf?rl=2,现在有点晚了,696,neutral
1848,2020-02-02,https://weibo.cn/comment/hot/IsmPktxtf?rl=2,现在老百姓得不到有效的防护和消毒物资。还上什么班,613,neutral
1849,2020-02-02,https://weibo.cn/comment/hot/IsmPktxtf?rl=2,央视记者进得了叙利亚战场，进得了巴西贩毒窝点，进不去自己国家湖北红十字的仓库。 笑话二：法国总统的车都进不了故宫，我们一莫名其妙的女的可以开大奔进去。 笑话三：我买到了我捐赠的物资。  ,537,angry
1850,2020-02-02,https://weibo.cn/comment/hot/Isn8R8gxQ?rl=2,带节奏适可而止。现在全国必须多些正能量，那些腐败问题，国家会秋后算账的，没必要传播太多负面消息，现在需要全国人团结的时候，我们一起加油，一定可以战胜任何困难,6327,hopeful
1851,2020-02-02,https://weibo.cn/comment/hot/Isn8R8gxQ?rl=2,辛苦了 钟老,3415,worry
1852,2020-02-02,https://weibo.cn/comment/hot/Isn8R8gxQ?rl=2,本来很好处理的一事儿，可是就是有这么部分人不怕事儿大，本来就在疫区发还乱跑。这也就导致其过程接触更多的人，就会产生2代3代传染。虽然现在国家有这么多措施在进行，但是大多数地区是做不到的。因为这事很多需要物资人没有获取到应有的物资，也就加大了工作的困难度。,1719,satisfied
1853,2020-02-02,https://weibo.cn/comment/hot/Isn8R8gxQ?rl=2,钟老之前的判断是正月十五，现在的判断是十天或两周后，说明疫情可能还是很严峻的。不可掉以轻心。,1629,worry
1854,2020-02-02,https://weibo.cn/comment/hot/Isn8R8gxQ?rl=2,我真的好难受啊，希望一切能早点结束,909,hopeful
1855,2020-02-02,https://weibo.cn/comment/hot/Isn8R8gxQ?rl=2,还要两周到高峰啊,340,neutral
1856,2020-02-02,https://weibo.cn/comment/hot/IsngCcpRU?rl=2,红十字会这事，不管后面的山有多硬，里面的水有多深，必须死磕到底。人民总得赢一次。 人民也是水，水的稳定，在于疏，不在于堵。再深的水，都不能凌越于人民之上。,664,angry
1857,2020-02-02,https://weibo.cn/comment/hot/IsngCcpRU?rl=2,那么多疑似的，为什么现在还不鉴别诊断呢？还在差核算试纸吗？不可能吧？ 主要问题出在哪里呢？诊断鉴别了没有地方收治？那么火神山。。这2个医院也就2500个床位呀。按比例算下来，疑似里面有一半能确诊的，这个床位也不够呀？政府真的不能只做表面工作，还得想想办法呀……一定要尽快把疑似的解决呀,217,suspicious
1858,2020-02-02,https://weibo.cn/comment/hot/IsngCcpRU?rl=2,唉，今天发不会主持人都不点记者提问了。偏偏提问的记者都是湖北本地的媒体。偏偏记者提问的问题领导同志们稿子上都有？？真是巧合！！,174,angry
1859,2020-02-02,https://weibo.cn/comment/hot/IsngCcpRU?rl=2,郑重倡议：我们喷红十也好，骂湖北某些领导也好，但是当前还是要听从国家中央安排，不外出，不聚集，不造谣，不传谣，多洗手，多通风！最重要一点千万不要让营销号带节奏，我们见一次集体举报拉黑！🙏🙏祝福武汉，祝福祖国,152,neutral
1860,2020-02-02,https://weibo.cn/comment/hot/IsngCcpRU?rl=2,二流报纸,147,neutral
1861,2020-02-02,https://weibo.cn/comment/hot/IsngCcpRU?rl=2,全程对着稿子读，记者提问没有一句关于红十字会，都是湖北本地媒体提问。直播间禁止弹幕，真的秀啊。,134,angry
1862,2020-02-02,https://weibo.cn/comment/hot/IsngCcpRU?rl=2,钟老说未来10天或是高峰期，大家注意，我看看再和领导请10天假,60,worry
1863,2020-02-02,https://weibo.cn/comment/hot/Isnnj5E5A?rl=2,大鄂所有微博全没了，一条不剩，这个真厉害,2584,moved
1864,2020-02-02,https://weibo.cn/comment/hot/Isnnj5E5A?rl=2,钟老您怎么说我们怎么听 辛苦了,1157,worry
1865,2020-02-02,https://weibo.cn/comment/hot/Isnnj5E5A?rl=2,国内某家日报，乃中国最牛逼的卖货大V啊。嗷买噶，大家快去买它！ 终于明白为啥国内当官的家属，有钱人，明星们都要整个绿卡了。中国有事情发生，他们可以跑出去避难，国外出事了，他们可以跑回来避难。两头跑，真奇妙！另外，鄂车牌号怎么回事呢？,726,excited
1866,2020-02-02,https://weibo.cn/comment/hot/Isnnj5E5A?rl=2,听钟老的[加油],372,hopeful
1867,2020-02-02,https://weibo.cn/comment/hot/Isnnj5E5A?rl=2,请问只有核酸检测这一种可以确诊吗？像我们这地区试纸根本不够用，查血可以吗？白细胞正常可以排除没有携带病毒吗？但是连续低烧37.3℃4天了，不知道怎么回事@人民日报,3,suspicious
1868,2020-02-02,https://weibo.cn/comment/hot/IsnEqbIGa?rl=2,杭州的防御意识和措施在中国排第一。,8396,suspicious
1869,2020-02-02,https://weibo.cn/comment/hot/IsnEqbIGa?rl=2,浙江政府还是真行,6702,unsatisfied
1870,2020-02-02,https://weibo.cn/comment/hot/IsnEqbIGa?rl=2,我觉得已经越来越好了，能不能给zf点时间和信任，起码江浙沪河南广东做的还是不错的，不能一味的批评吧，真正做事的领导被误伤也会难过的,2347,neutral
1871,2020-02-02,https://weibo.cn/comment/hot/IsnZ8EgE7?rl=2,立党为公，执政为民。,11880,neutral
1872,2020-02-02,https://weibo.cn/comment/hot/IsnZ8EgE7?rl=2,以后每天公布，这是大家的捐款,6682,neutral
1873,2020-02-02,https://weibo.cn/comment/hot/IsnZ8EgE7?rl=2,好，信息透明公开，很好👍加油💪,2889,hopeful
1874,2020-02-02,https://weibo.cn/comment/hot/IsnZ8EgE7?rl=2,这不是红十字会，你们喷子有脑子吗？,1860,angry
1875,2020-02-02,https://weibo.cn/comment/hot/IsnZ8EgE7?rl=2,善待医务人员,1811,neutral
1876,2020-02-02,https://weibo.cn/comment/hot/IsnZ8EgE7?rl=2,慈善总会不等于红十字会！！,1653,angry
1877,2020-02-02,https://weibo.cn/comment/hot/Iso1QtV3c?rl=2,红十字！还要说多少次？,8512,neutral
1878,2020-02-02,https://weibo.cn/comment/hot/Iso1QtV3c?rl=2,山东防疫措施做的很到位了！不要再断章取义了！您别再带节奏地域黑了好吗！,4981,angry
1879,2020-02-02,https://weibo.cn/comment/hot/Iso1QtV3c?rl=2,这是山东截止目前发现的病例中所有的，并不是刚刚发现,2028,unsatisfied
1880,2020-02-02,https://weibo.cn/comment/hot/Iso1QtV3c?rl=2,宁能把时间线列出来给大家伙看看吗？？？啥玩意儿都没了解清楚就开始喷！我们做错什么了，疫情分析报告发早了呗！有本事各个省份都发一下！看看山东的防控怎么样？一个官媒不能把山东推到这个地步吧，蔬菜我们无偿捐了，武汉那边怎么做的你们管了吗，你们评了吗？,2022,neutral
1881,2020-02-02,https://weibo.cn/comment/hot/Iso1QtV3c?rl=2,能不能不说好久之前的事情，我们山东作为人口大省已经控制不错的了，作为人民日报三番五次的带动不良信息，就是你们做日报的前提吗,1506,satisfied
1882,2020-02-02,https://weibo.cn/comment/hot/IslLQFW0q?rl=2,红十字就是滑天下之大G,115631,neutral
1883,2020-02-02,https://weibo.cn/comment/hot/IslLQFW0q?rl=2,截都截了...,75597,neutral
1884,2020-02-02,https://weibo.cn/comment/hot/IslLQFW0q?rl=2,会听吗？希望吧,19676,hopeful
1885,2020-02-02,https://weibo.cn/comment/hot/IslLQFW0q?rl=2,红十字会应该做个云监工,15023,angry
1886,2020-02-02,https://weibo.cn/comment/hot/IslLQFW0q?rl=2,怨不得人民如此愤怒 大家只想在一线的所有英雄们不被辜负,12942,angry
1887,2020-02-02,https://weibo.cn/comment/hot/IslLQFW0q?rl=2,然并卵，人民已经买不起口罩，也买不到口罩了，发国难财的人后台太硬了,4664,angry
1888,2020-02-02,https://weibo.cn/comment/hot/Isk4o4JKJ?rl=2,如果是这样，那为什么撤热搜？,3189,angry
1889,2020-02-02,https://weibo.cn/comment/hot/Isk4o4JKJ?rl=2,讲那么多，我还是没听懂，捐赠的口罩难道不是给一线工作人员用的？那些坐办公室的官员想要口罩自己不会买？,3019,angry
1890,2020-02-02,https://weibo.cn/comment/hot/Isk4o4JKJ?rl=2,捐资走的是一条神奇通道——湖北红十字会,2334,angry
1891,2020-02-02,https://weibo.cn/comment/hot/Isk4o4JKJ?rl=2,不是呼吁n95要留给医护人员吗,2145,suspicious
1892,2020-02-02,https://weibo.cn/comment/hot/IsjBJ1ERm?rl=2,那些说刷车牌很烦的，相关热搜撤的一干二净，如果连这点都不坚持，你看，那些狗官又该多得瑟，骂故宫大G不能刷 骂野味不能刷 骂海鲜市场余甜不能刷 骂车牌不能刷 骂红十不能刷……是什么都不能刷，问题是什么都没解决啊。十年一轮回，大家再一次忘的一干二净。你看，大家多健忘。,1340,angry
1893,2020-02-02,https://weibo.cn/comment/hot/IsjBJ1ERm?rl=2,听说有个车牌是关系户？,756,neutral
1894,2020-02-02,https://weibo.cn/comment/hot/IsjBJ1ERm?rl=2,我向来是不惮以最坏的恶意，来推测中国人的，然而我还不料，也不信竟会下劣凶残到这地步。,370,neutral
1895,2020-02-02,https://weibo.cn/comment/hot/IsjBJ1ERm?rl=2,“谁犯了官僚主义，不去解决群众的问题，骂群众，压群众，总是不改，群众就有理由把他革掉。”——毛主席，1958,2,unsatisfied
1896,2020-02-02,https://weibo.cn/comment/hot/IsjBJ1ERm?rl=2,你🐊了吗？我很A了，零贰陆零是个大不溜。你🐊了吗？我很A了，零贰陆零是个大不溜。 会唱吗？哈哈哈……,127,neutral
1897,2020-02-02,https://weibo.cn/comment/hot/IsjBJ1ERm?rl=2,疫情结束以后，该查的查，该办的办，我们都不会忘。,107,angry
1898,2020-02-02,https://weibo.cn/comment/hot/IsjBJ1ERm?rl=2,老天心都寒了，你看着雪像不像老百姓捐的物资,81,neutral
1899,2020-02-02,https://weibo.cn/comment/hot/IsksywDql?rl=2,那些说刷车牌很烦的，相关热搜撤的一干二净，如果连这点都不坚持，你看，那些狗官又该多得瑟，骂故宫大G不能刷 骂野味不能刷 骂海鲜市场余甜不能刷 骂车牌不能刷 骂红十不能刷……是什么都不能刷，问题是什么都没解决啊。十年一轮回，大家再一次忘的一干二净，你看，大家多健忘（我复制的）,2406,angry
